"project_id","title","description","crs_sector_name","sources","factiva_sources","GEO_sources","GEO_notes","Christian.Notes","level","X","Y","name","name_type","GID","country"
39562,"CDB and Bank of China provide a $1.8 billion USD syndicated loan for Phase I of the Beineu-Bozoi-Shymkent Gas Pipeline Project (Linked to Project ID#40362 and #73384)","On January 18, 2011, a joint venture (special purpose vehicle) called Beineu-Shymkent Gas Pipeline LLP (BSGP) was established in Kazakhstan to oversee the financing, design, and implementation of the Beineu-Bozoi-Shymkent Gas Pipeline Project. JSC KazTransGas (KTG) and China National Petroleum Corporation (CNPC) (acting through Trans-Asia Gas Pipeline Company Limited) each held a 50% ownership stake in BSGP (see JV formation date at “PROJECTS OF EXPORT GAS PIPELINES”; see rest at pg.37 of ""JSC NC “KazMunayGas” 2018 Base Prospectus"").

The Beineu-Bozoi-Shymkent Gas Pipeline was a 1454 km long gas pipeline that running through the Mangistau, Aktyubinsk, Kyzylorda and South Kazakhstan regions. It has a pipe diameter of 1067 mm (see “Beineu-Bozoy-Shymkent gas pipeline is the largest pipeline project...” and pg.149 of ""JSC NC “KazMunayGas” 2018 Base Prospectus""). The purpose of the project was to ensure stable gas demand in the southern Kazakhstan, reduce dependence on imported gas and ensure the energy security of Kazakhstan. Construction of the pipeline was split into two phases (see “PROJECTS OF EXPORT GAS PIPELINES”).

The first phase of the Beineu-Bozoi-Shymkent Gas Pipeline Project involved the construction of 1,143.2 km of pipeline from the Bozoi gas metering station in the Shalkar region of Aktobe Region to Akbulak gas metering station in Sairam of South Kazakhstan Region (now known as the Turkistan Region). It also involved the installation of pipeline facilities, such as: compressor station CS-1 and Bozoy shift camp in Shalkar region of Aktobe Region, emergency-response centers in Saksaulsk, Aksuat and Karaozek in the Kyzylorda Region and an emergency-response center in Shornak within the South Kazakhstan Region, as well as construction of the automated process control system (SCADA) and telecommunication (fiber-optic communication line) for the gas pipeline in Mangystau, Aktobe, Kyzylorda and South Kazakhstan regions (see ""About the company""). The first phase of the Beineu-Bozoi-Shymkent Gas Pipeline Project was initiated on July 17, 2012 (see pg.29 of ""JSC NC ""KazMunayGas"" Annual Report 2013""). The project was expected to be completed by the end of 2012 (see ""China and Kazakhstan begin construction of the second stage of the gas pipeline""). It was completed on September 7, 2013, resulting in a throughput capacity of up to 10 bcm per year (see ""First section of China-Kazakstan gas pipeline II starts operation"").

The second phase of the Beineu-Bozoi-Shymkent Gas Pipeline Project involved 306.3 km of gas pipeline construction from Beineu settlement in the Mangystau Region to Bozoi settlement in the Aktobe Region. It also involved the installation of pipeline facilities, such as: compressor station CS-4 Karaozek in the Kyzylorda Region, Beineu gas metering station in Mangystau Region, the SCADA central dispatch control in Kyzylorda, and gas pipeline construction in Mangystau, Aktobe, Kyzylorda and South Kazakhstan regions (see ""About the company""). It was completed on December 30, 2016 (see ""PROJECTS OF EXPORT GAS PIPELINES"").

Between 2014 and 2017, over 9.0 bcm of gas was transported via the Beineu-Bozoi-Shymkent gas pipeline, providing the southern regions with Kazakhstani gas. Then, in November 2017, a head compressor station at Bozoi and a line compressor station at Karaozek were put into operation, increasing the capacity of the Beineu-Bozoi-Shymkent Gas Pipeline to 10 bcm per year. In October 2017, Kazakhstan began exporting gas to China pursuant to a contract concluded between JSC KazTransGas and PetroChina for the supply of bcm from October 15, 2017 until October 14, 2018. The price of the gas exported to China pursuant to this agreement was linked to the price of Brent crude oil and determined quarterly. As of December 31, 2017, negotiations were ongoing with respect to a long-term gas supply agreement between JSC KazTransGas and PetroChina. BSGP and KazMunayGas expected that the export of gas to China would increase in the future and made plans to construct three new compressor stations on the Beineu-Bozoi-Shymkent Gas Pipeline between 2018 and 2019 to handle this (see pg.151-152 of ""JSC NC “KazMunayGas” 2018 Base Prospectus"").

In order to fund Phase I of the Beineu-Bozoi-Shymkent Gas Pipeline Project, Beineu-Shymkent Gas Pipeline LLP signed a $1.8 billion USD syndicated loan with China Development Bank (CDB) and Bank of China (BOC) on December 11, 2012 (captured by this project). This loan bears interest at a rate of 3-month LIBOR + a 2.7% margin per annum for the duration of the guarantee period (until December 31, 2019) and, thereafter, at a rate of 3-month LIBOR + a 3.2% margin per annum. The loan was to be repaid in several installments beginning in December 2017 until March 11, 2028 (implying a grace period of 5 years and a maturity period of 15.25 years). The loan was secured by corporate guarantees from KazMunayGas and CNPC. Unspecified amendments to the facility were made in February 2016 (see pg.85 of ""JSC NC “KazMunayGas” 2017 Base Prospectus"" and pg.110 of ""JSC NC “KazMunayGas” 2018 Base Prospectus"").

In February 2016 and September 2017, amendments were signed because of BSGP's non-compliance with certain project milestones provided for in the facility agreement; the milestones were extended until September 30, 2019. These amendments required BSGP's prepayment of $400 million USD of the outstanding indebtedness, which KazMunayGas provided to BSGP for repayment. The loan was secured by additional security, including an offshore account charge, an onshore account pledge and security assignment of BSGP's rights under the shareholder support agreement in favor of the security agent. As of June 30, 2017, the outstanding indebtedness under the loan was $1.462 billion USD (see pg.85 of ""JSC NC “KazMunayGas” 2017 Base Prospectus""). As of December 31, 2017, the outstanding principal amount under this loan was $1.0 billion USD (see pg.110 of ""JSC NC “KazMunayGas” 2018 Base Prospectus"").

Then, on September 17, 2015, Beineu-Shymkent Gas Pipeline LLP signed a $700 million USD syndicated loan with CDB and BOC for Phase II of the project to supplement their $1.8 billion USD loan. CDB and BOC each reportedly contributed $350 million USD. This loan reportedly carries a maturity period of 15 years; the maturity date was September 17, 2030. The interest rate of the loan is unknown (see “Beineu-Shymkent Gas Pipeline Phase2 Additional Financing”). For the BOC contribution, see linked project ID#73384; for the CDB contribution, see linked project ID#40362.

STAFF_NOTE: The 3-month LIBOR rate in December 2012 was 0.309%. The interest rate, therefore, was coded as 0.309% + 2.7%, or 3.009%.

This 1,454 km pipeline runs through the Mangystau, Aktobe, Kyzylorda and South Kazakhstan regions. More detailed locational information can be found at https://www.dropbox.com/s/8j082veud49pzvb/_i%20class%3D_fa%20fa-map%20fa-lg____i_%20Pipeline%20map%20%E2%80%93%20Beineu%20Shymkent.pdf?dl=0 and https://bsgp.kz/en_US/%d0%ba%d0%b0%d1%80%d1%82%d0%b0-%d0%b3%d0%b0%d0%b7%d0%be%d0%bf%d1%80%d0%be%d0%b2%d0%be%d0%b4%d0%b0/ and https://www.kaztransoil.kz/en/about_the_company/main_pipelines_scheme/","Energy Generation and Supply","http://kz.chineseembassy.org/rus/zhgx/t770683.htm, Government Source (Donor/Recipient); http://kz.chineseembassy.org/rus/zhgx/t782268.htm, Government Source (Donor/Recipient); https://www.ashurst.com/media-item.aspx?id_Content=12329, Other Academic (Working Paper, Dissertation); http://www.inform.kz/eng/article/2634098, Media Report, including Wikileaks; http://www.kaztransgas.kz/index.php/en/main-page/projects/mg-beyneu-shymkent-building, Other Official Source (non-Donor, non-Recipient); https://global.factiva.com/redir/default.aspx?P=sa&an=FINAE00020140520ea5k0000s&cat=a&ep=ASE, Media Report, including Wikileaks; http://en.tengrinews.kz/industry_infrastructure/Shymkent-Oil-Refinery-to-receive-additional-400-million-for-257205/, Media Report, including Wikileaks; http://www.reuters.com/article/oil-kazakhstan-china-idUSL5E8H667N20120606, Media Report, including Wikileaks; https://global.factiva.com/du/article.aspx/?accessionno=EURGAS0020140516ea5f0000c&fcpil=en&napc=S&sa_from=&cat=a, Media Report, including Wikileaks; https://global.factiva.com/redir/default.aspx?P=sa&an=CHINEN0020101103e6ak00001&cat=a&ep=ASE, Media Report, including Wikileaks; http://www.reuters.com/article/kaztransgas-loan-idUSL5N10U36D20150819, Media Report, including Wikileaks; http://en.energo.gov.kz/index.php?id=4673, Government Source (Donor/Recipient); http://www.naturalgaseurope.com/jsc-kaztransgaz-connects-west-with-the-south-26652, Media Report, including Wikileaks; http://kazakh-tv.kz/en/view/news_kazakhstan/page_122270_, Media Report, including Wikileaks; http://kz.china-embassy.org/rus/zhgx/t782268.htm, Government Source (Donor/Recipient); https://global.factiva.com/redir/default.aspx?P=sa&an=TREOGE0020150116eb1g0000p&cat=a&ep=ASE, Media Report, including Wikileaks; https://global.factiva.com/redir/default.aspx?P=sa&an=TREOGE0020150116eb1g0000p&cat=a&ep=ASE, Media Report, including Wikileaks; https://www.dropbox.com/s/r0ma2jdu2gw9wmd/IJGlobal%20-%20Beineu-Shymkent%20Gas%20Pipeline%20Phase%202%20Additional%20Financing%20-%20Kazakhstan%20and%20China.pdf?dl=0, Other Official Source (non-Donor, non-Recipient); https://uc1bf25c866be68e5ee73a595e25.previews.dropboxusercontent.com/nativeprint?file=https%3A%2F%2Fwww.dropbox.com%2Fs%2Fgvxafjn32lses2g%2F2013%2520Bond%2520Prospects%2520for%2520Kazakhstan%2520State-Owned%2520Gas%2520Company.pdf%3Fdisable_range%3D1%26from_native_print%3D1%26preview%3D1, Implementing/Intermediary Agency Source; http://kase.kz/files/emitters/KMGZ/kmgzf4_2018_eng.pdf, Implementing/Intermediary Agency Source; https://kase.kz/files/emitters/KZTG/kztgf9e1_2017.pdf, Implementing/Intermediary Agency Source; http://www.kmg.kz/uploads/documents/reports/2013/eng/god2013eng.pdf, Implementing/Intermediary Agency Source; https://www.kaztransgas.kz/index.php/en/37-project, Implementing/Intermediary Agency Source; https://www.icis.com/explore/resources/news/2013/09/09/9704150/first-section-of-china-kazakstan-gas-pipeline-ii-starts-operation/, Other; https://www.sec.gov/Archives/edgar/data/1608672/000119312514207809/d728917dex991.htm, Implementing/Intermediary Agency Source; https://bsgp.kz/en_US/, Implementing/Intermediary Agency Source; https://bsgp.kz/en_US/%D2%9B%D0%B0%D0%B7%D1%82%D1%80%D0%B0%D0%BD%D1%81%D0%B3%D0%B0%D0%B7-%D0%B0%D2%9B-%D0%B5%D0%BB%D1%96%D0%BC%D1%96%D0%B7%D0%B4%D1%96%D2%A3-%D0%B1%D0%B0%D1%82%D1%8B%D1%81%D1%8B%D0%BD-%D0%BE/, Implementing/Intermediary Agency Source; https://www.dropbox.com/s/o73wxg53o6oo07z/Experience.pdf?dl=0, Implementing/Intermediary Agency Source; https://bsgp.kz/en_US/%d0%be-%d0%ba%d0%be%d0%bc%d0%bf%d0%b0%d0%bd%d0%b8%d0%b8/, Implementing/Intermediary Agency Source","https://global.factiva.com/redir/default.aspx?P=sa&an=FINAE00020140520ea5k0000s&cat=a&ep=ASE, Media Report, including Wikileaks; https://global.factiva.com/du/article.aspx/?accessionno=EURGAS0020140516ea5f0000c&fcpil=en&napc=S&sa_from=&cat=a, Media Report, including Wikileaks; https://global.factiva.com/redir/default.aspx?P=sa&an=CHINEN0020101103e6ak00001&cat=a&ep=ASE, Media Report, including Wikileaks; https://global.factiva.com/redir/default.aspx?P=sa&an=TREOGE0020150116eb1g0000p&cat=a&ep=ASE, Media Report, including Wikileaks; https://global.factiva.com/redir/default.aspx?P=sa&an=TREOGE0020150116eb1g0000p&cat=a&ep=ASE, Media Report, including Wikileaks","https://bsgp.kz/en_US/; https://en.wikipedia.org/wiki/Kyzylorda_Region","Codep up to ADM1 to the Kyzylorda region. The description said the pipeline ran through the Mangistau, Aktyubinsk, Kyzylorda and South Kazakhstan regions which i geocoded using qgis and geojson","good code up","province",63.63,45.17,"Qyzylorda","Region","KAZ.11_1","Kazakhstan"
40362,"CDB provides $350 million USD via a $700 million USD syndicated loan for Phase II of the Beineu-Bozoi-Shymkent Gas Pipeline Project (Additional Financing) (Linked to Project ID#39562 and #73384)","On January 18, 2011, a joint venture (special purpose vehicle) called Beineu-Shymkent Gas Pipeline LLP (BSGP) was established in Kazakhstan to oversee the financing, design, and implementation of the Beineu-Bozoi-Shymkent Gas Pipeline Project. JSC KazTransGas (KTG) and China National Petroleum Corporation (CNPC) (acting through Trans-Asia Gas Pipeline Company Limited) each held a 50% ownership stake in BSGP (see JV formation date at “PROJECTS OF EXPORT GAS PIPELINES”; see rest at pg.37 of ""JSC NC “KazMunayGas” 2018 Base Prospectus"").

The Beineu-Bozoi-Shymkent Gas Pipeline was a 1454 km long gas pipeline that running through the Mangistau, Aktyubinsk, Kyzylorda and South Kazakhstan regions. It has a pipe diameter of 1067 mm (see “Beineu-Bozoy-Shymkent gas pipeline is the largest pipeline project...” and pg.149 of ""JSC NC “KazMunayGas” 2018 Base Prospectus""). The purpose of the project was to ensure stable gas demand in the southern Kazakhstan, reduce dependence on imported gas and ensure the energy security of Kazakhstan. Construction of the pipeline was split into two phases (see “PROJECTS OF EXPORT GAS PIPELINES”).

The first phase of the Beineu-Bozoi-Shymkent Gas Pipeline Project involved the construction of 1,143.2 km of pipeline from the Bozoi gas metering station in the Shalkar region of Aktobe Region to Akbulak gas metering station in Sairam of South Kazakhstan Region (now known as the Turkistan Region). It also involved the installation of pipeline facilities, such as: compressor station CS-1 and Bozoy shift camp in Shalkar region of Aktobe Region, emergency-response centers in Saksaulsk, Aksuat and Karaozek in the Kyzylorda Region and an emergency-response center in Shornak within the South Kazakhstan Region, as well as construction of the automated process control system (SCADA) and telecommunication (fiber-optic communication line) for the gas pipeline in Mangystau, Aktobe, Kyzylorda and South Kazakhstan regions (see ""About the company""). The first phase of the Beineu-Bozoi-Shymkent Gas Pipeline Project was initiated on July 17, 2012 (see pg.29 of ""JSC NC ""KazMunayGas"" Annual Report 2013""). The project was expected to be completed by the end of 2012 (see ""China and Kazakhstan begin construction of the second stage of the gas pipeline""). It was completed on September 7, 2013, resulting in a throughput capacity of up to 10 bcm per year (see ""First section of China-Kazakstan gas pipeline II starts operation"").

The second phase of the Beineu-Bozoi-Shymkent Gas Pipeline Project involved 306.3 km of gas pipeline construction from Beineu settlement in the Mangystau Region to Bozoi settlement in the Aktobe Region. It also involved the installation of pipeline facilities, such as: compressor station CS-4 Karaozek in the Kyzylorda Region, Beineu gas metering station in Mangystau Region, the SCADA central dispatch control in Kyzylorda, and gas pipeline construction in Mangystau, Aktobe, Kyzylorda and South Kazakhstan regions (see ""About the company""). It was completed on December 30, 2016 (see ""PROJECTS OF EXPORT GAS PIPELINES"").

Between 2014 and 2017, over 9.0 bcm of gas was transported via the Beineu-Bozoi-Shymkent gas pipeline, providing the southern regions with Kazakhstani gas. Then, in November 2017, a head compressor station at Bozoi and a line compressor station at Karaozek were put into operation, increasing the capacity of the Beineu-Bozoi-Shymkent Gas Pipeline to 10 bcm per year. In October 2017, Kazakhstan began exporting gas to China pursuant to a contract concluded between JSC KazTransGas and PetroChina for the supply of bcm from October 15, 2017 until October 14, 2018. The price of the gas exported to China pursuant to this agreement was linked to the price of Brent crude oil and determined quarterly. As of December 31, 2017, negotiations were ongoing with respect to a long-term gas supply agreement between JSC KazTransGas and PetroChina. BSGP and KazMunayGas expected that the export of gas to China would increase in the future and made plans to construct three new compressor stations on the Beineu-Bozoi-Shymkent Gas Pipeline between 2018 and 2019 to handle this (see pg.151-152 of ""JSC NC “KazMunayGas” 2018 Base Prospectus"").

In order to fund Phase I of the Beineu-Bozoi-Shymkent Gas Pipeline Project, Beineu-Shymkent Gas Pipeline LLP signed a $1.8 billion USD syndicated loan with China Development Bank (CDB) and Bank of China (BOC) on December 11, 2012 (see linked project ID#39562). This loan bears interest at a rate of 3-month LIBOR + a 2.7% margin per annum for the duration of the guarantee period (until December 31, 2019) and, thereafter, at a rate of 3-month LIBOR + a 3.2% margin per annum. The loan was to be repaid in several installments beginning in December 2017 until March 11, 2028 implying a grace period of 5 years and a maturity period of 15.25 years). The loan was secured by corporate guarantees from KazMunayGas and CNPC. Unspecified amendments to the facility were made in February 2016 (see pg.85 of ""JSC NC “KazMunayGas” 2017 Base Prospectus"" and pg.110 of ""JSC NC “KazMunayGas” 2018 Base Prospectus"").

In February 2016 and September 2017, amendments were signed because of BSGP's non-compliance with certain project milestones provided for in the facility agreement; the milestones were extended until September 30, 2019. These amendments required BSGP's prepayment of $400 million USD of the outstanding indebtedness, which KazMunayGas provided to BSGP for repayment. The loan was secured by additional security, including an offshore account charge, an onshore account pledge and security assignment of BSGP's rights under the shareholder support agreement in favor of the security agent. As of June 30, 2017, the outstanding indebtedness under the loan was $1.462 billion USD (see pg.85 of ""JSC NC “KazMunayGas” 2017 Base Prospectus""). As of December 31, 2017, the outstanding principal amount under this loan was $1 billion USD (see pg.110 of ""JSC NC “KazMunayGas” 2018 Base Prospectus"").

Then, on September 17, 2015, Beineu-Shymkent Gas Pipeline LLP signed a $700 million USD syndicated loan with CDB and BOC for Phase II of the project to supplement their $1.8 billion USD loan. CDB and BOC each contributed $350 million USD. This loan reportedly carries a maturity period of 15 years; the maturity date was September 17, 2030. The interest rate of the loan is unknown (see “Beineu-Shymkent Gas Pipeline Phase2 Additional Financing”). This project captures the CDB contribution; for the BOC contribution, see linked project ID#73384.

This 1,454 km pipeline runs through the Mangystau, Aktobe, Kyzylorda and South Kazakhstan regions. More detailed locational information can be found at https://www.dropbox.com/s/8j082veud49pzvb/_i%20class%3D_fa%20fa-map%20fa-lg____i_%20Pipeline%20map%20%E2%80%93%20Beineu%20Shymkent.pdf?dl=0 and https://bsgp.kz/en_US/%d0%ba%d0%b0%d1%80%d1%82%d0%b0-%d0%b3%d0%b0%d0%b7%d0%be%d0%bf%d1%80%d0%be%d0%b2%d0%be%d0%b4%d0%b0/ and https://www.kaztransoil.kz/en/about_the_company/main_pipelines_scheme/","Energy Generation and Supply","https://global.factiva.com/redir/default.aspx?P=sa&an=TRENDE0020140228ea2s0015p&cat=a&ep=ASE, Media Report, including Wikileaks; https://global.factiva.com/redir/default.aspx?P=sa&an=TRAFIN0020140328ea3c0004c&cat=a&ep=ASE, Media Report, including Wikileaks; http://www.kazakhstan.org.sg/content/intro.php?act=news&c_id=2898, Government Source (Donor/Recipient); http://halyk-ipo.kz/en/kaztransgaz-vzyal-kredit-u-kitajskih-bankov.html, Media Report, including Wikileaks; http://www.reuters.com/article/kaztransgas-loan-idUSL5N10U36D20150819, Media Report, including Wikileaks; http://bsgp.kz/eng/index.php?section=4&category=news&item_id=624, Implementing/Intermediary Agency Source; https://www.dropbox.com/s/r0ma2jdu2gw9wmd/IJGlobal%20-%20Beineu-Shymkent%20Gas%20Pipeline%20Phase%202%20Additional%20Financing%20-%20Kazakhstan%20and%20China.pdf?dl=0, Other Official Source (non-Donor, non-Recipient); https://bsgp.kz/en_US/, Implementing/Intermediary Agency Source; https://www.sec.gov/Archives/edgar/data/1608672/000119312514207809/d728917dex991.htm, Implementing/Intermediary Agency Source; https://bsgp.kz/en_US/%D2%9B%D0%B0%D0%B7%D1%82%D1%80%D0%B0%D0%BD%D1%81%D0%B3%D0%B0%D0%B7-%D0%B0%D2%9B-%D0%B5%D0%BB%D1%96%D0%BC%D1%96%D0%B7%D0%B4%D1%96%D2%A3-%D0%B1%D0%B0%D1%82%D1%8B%D1%81%D1%8B%D0%BD-%D0%BE/, Implementing/Intermediary Agency Source; https://www.kaztransgas.kz/index.php/en/37-project, Implementing/Intermediary Agency Source; https://kazakh-tv.kz/en/view/news_kazakhstan/page_134545_main-gas-pipeline-%E2%80%98beineu-shymkent-bozoi%E2%80%99-put-into-operation, Media Report, including Wikileaks; https://www.naturalgasworld.com/jsc-kaztransgaz-connects-west-with-the-south-26652, Media Report, including Wikileaks; https://www.ashurst.com/en/news-and-insights/news-deals-and-awards/ashurst-advises-on-financing-of-beineushymkent-gas-pipeline-construction/, Other Official Source (non-Donor, non-Recipient); https://kase.kz/files/emitters/KZTG/kztgf9e1_2017.pdf, Implementing/Intermediary Agency Source; http://kase.kz/files/emitters/KMGZ/kmgzf4_2018_eng.pdf, Implementing/Intermediary Agency Source; https://www.icis.com/explore/resources/news/2013/09/09/9704150/first-section-of-china-kazakstan-gas-pipeline-ii-starts-operation/, Other; http://www.kmg.kz/uploads/documents/reports/2013/eng/god2013eng.pdf, Implementing/Intermediary Agency Source; https://bsgp.kz/en_US/%d0%be-%d0%ba%d0%be%d0%bc%d0%bf%d0%b0%d0%bd%d0%b8%d0%b8/, Implementing/Intermediary Agency Source","https://global.factiva.com/redir/default.aspx?P=sa&an=TRENDE0020140228ea2s0015p&cat=a&ep=ASE, Media Report, including Wikileaks; https://global.factiva.com/redir/default.aspx?P=sa&an=TRAFIN0020140328ea3c0004c&cat=a&ep=ASE, Media Report, including Wikileaks","https://bsgp.kz/en_US/; https://en.wikipedia.org/wiki/Kyzylorda_Region","Codep up to ADM1 to the Kyzylorda region. The description said the pipeline ran through the Mangistau, Aktyubinsk, Kyzylorda and South Kazakhstan regions which i geocoded using qgis and geojson","good","province",63.63,45.17,"Qyzylorda","Region","KAZ.11_1","Kazakhstan"
