"project_id","title","description","crs_sector_name","sources","factiva_sources","GEO_sources","GEO_notes","Christian.Notes","level","X","Y","name","name_type","GID","country"
40265,"Bank of China provides a $232 million USD loan for the Bitumen (Asphalt) Plant Construction Project (Linked to Project ID#55030 and #73404)","On September 28, 2010, the Bank of China (BOC) signed a $232 million USD loan agreement for the construction of a bitumen (asphalt) plant in Aktau (see ""Bank of China to provide $232 ml loan to finance construction of an asphalt plant in Aktau""). The loan carried a maturity period of seven years, and JV Caspi Bitum LLP pledged the plant as a guarantee for the loan. JV Caspi Bitum LLP was a project company (special purpose vehicle) that established in October 2009 to assume responsible for the financing, design, and implementation of the Bitumen Asphalt Plant Construction Project. Its owners were Kazakhstan Petrochemical Industries JSC (KPI) (50%), a subsidiary of KazMunay Gas, and CITIC Kazakhstan LLP (50%), a subsidiary of CITIC Group (see ""НЕФТЬ""). The proceeds of the BOC loan were meant to cover 80% of the cost of the bitumen (asphalt) plant (see ""National Company KazMunayGas (Kazakhstan) informed about signing Loan Agreement...""). The total cost of the project was $290 million USD; KPI and CITIC Kazakhstan each contributed the remaining 10% ($29 million USD) (see pg.73 of ""KMG Annual Report 2010""). For CITIC Kazakhstan's contribution, see linked project ID#73404.

This bitumen asphalt plant was located in the city of Aktau, at the former Aktau Plastics Plant in the Mangystau Region. The project sought to construct a plant enable to produce high quality road bitumen in order to satisfy the Kazakhstan's requirements for road construction. The plant was expected to produce 406,500 tons of road bitumen, 225,400 tons of petrol-diesel fraction, and 330,300 tons of vacuum gas oil per year (see pg.35 of ""KMG Annual Report 2011""). The plant was planned to use up to 1 million tons of oil per year from the Mangystau Karazhanbas as feedstock. The plant was also intended to reduce Kazakhstan's reliance on Russian bitumen imports (see ""НЕФТЬ""). JSC OGCC KazStroyService and CITIC Construction Co., Ltd. were contractors responsible for project implementation (see ""Bank of China to provide $232 ml loan to finance construction of an asphalt plant in Aktau"")

Work on the project was expected to be completed in December 2012 (see pg.35 of ""KMG Annual Report 2011""). Construction was launched on June 9, 2010 (see ""Kazakh President launches construction of Aktau bitumen plant""). However, the official commissioning of the plant took place on December 12, 2013 (pg.35 of ""JSC NC ""KazMunayGas"" Annual Report 2013""). The project completion ceremony was held on December 20, 2013 (see ""Ambassador to Kazakhstan Le Yucheng Attends the Commissioning Ceremony..."").

This loan was refinanced by BOC in June 2016, as captured by linked project ID#55030.","Industry, Mining, Construction","https://global.factiva.com/redir/default.aspx?P=sa&an=KAZAEN0020100929e69t0000a&cat=a&ep=ASE, Media Report, including Wikileaks; https://global.factiva.com/redir/default.aspx?P=sa&an=KAZWIR0020100929e69s000xe&cat=a&ep=ASE, Media Report, including Wikileaks; http://kz.chineseembassy.org/rus/zhgx/t710297.htm, Government Source (Donor/Recipient); https://web.archive.org/web/20150927042204/https://kazakhembus.com/content/kazakh-president-visits-china-deals-worth-23-billion-signed, Media Report, including Wikileaks; http://investkz.com/en/journals/76/619.html, Media Report, including Wikileaks; https://web.archive.org/web/20150421010237/https://www.kmg.kz/upload/corporate_management/equity/2013/god2013eng.pdf, Implementing/Intermediary Agency Source; http://astanatimes.com/2014/01/bitumen-plant-commissioned-aktau-creating-another-link-china-kazakhstan/, Media Report, including Wikileaks; https://uc1bf25c866be68e5ee73a595e25.previews.dropboxusercontent.com/nativeprint?file=https%3A%2F%2Fwww.dropbox.com%2Fs%2Fgvxafjn32lses2g%2F2013%2520Bond%2520Prospects%2520for%2520Kazakhstan%2520State-Owned%2520Gas%2520Company.pdf%3Fdisable_range%3D1%26from_native_print%3D1%26preview%3D1 , Implementing/Intermediary Agency Source; http://astanatimes.com/2014/01/bitumen-plant-commissioned-aktau-creating-another-link-china-kazakhstan/, Media Report, including Wikileaks; http://www.kmg.kz/uploads/documents/reports/2010/eng/Godovoi_otchet_za_2010_god_en.pdf, Implementing/Intermediary Agency Source; https://www.caspibitum.kz/%D0%BE%D0%B1%D1%89%D0%B0%D1%8F-%D0%B8%D0%BD%D1%84%D0%BE%D1%80%D0%BC%D0%B0%D1%86%D0%B8%D1%8F/?lang=en, Other; http://whykmg.com/storage/files/71abca6dfe5c49fa/annual_report-ENG-s_obl2011.pdf, Implementing/Intermediary Agency Source; http://panoramakz.com/index.php/economics/oil/item/27997-, Media Report, including Wikileaks; https://en.trend.az/business/energy/1757986.html, Media Report, including Wikileaks; https://www.inform.kz/en/kazakh-president-launches-construction-of-aktau-bitumen-plant_a2276592, Media Report, including Wikileaks; https://kase.kz/files/emitters/KMGZ/kmgzp_2019_eng.pdf, Implementing/Intermediary Agency Source; http://construction.citic/en/content/details_47_2382.html, Implementing/Intermediary Agency Source; https://kase.kz/en/news/show/1117136/, Implementing/Intermediary Agency Source; https://www.fmprc.gov.cn/mfa_eng/wjb_663304/zwjg_665342/zwbd_665378/t1114299.shtml, Government Source (Donor/Recipient); https://uc1bf25c866be68e5ee73a595e25.previews.dropboxusercontent.com/nativeprint?file=https%3A%2F%2Fwww.dropbox.com%2Fs%2Fgvxafjn32lses2g%2F2013%2520Bond%2520Prospects%2520for%2520Kazakhstan%2520State-Owned%2520Gas%2520Company.pdf%3Fdisable_range%3D1%26from_native_print%3D1%26preview%3D1, Implementing/Intermediary Agency Source; https://uc1bf25c866be68e5ee73a595e25.previews.dropboxusercontent.com/nativeprint?file=https%3A%2F%2Fwww.dropbox.com%2Fs%2Fgvxafjn32lses2g%2F2013%2520Bond%2520Prospects%2520for%2520Kazakhstan%2520State-Owned%2520Gas%2520Company.pdf%3Fdisable_range%3D1%26from_native_print%3D1%26preview%3D1, Implementing/Intermediary Agency Source; https://uc1bf25c866be68e5ee73a595e25.previews.dropboxusercontent.com/nativeprint?file=https%3A%2F%2Fwww.dropbox.com%2Fs%2Fgvxafjn32lses2g%2F2013%2520Bond%2520Prospects%2520for%2520Kazakhstan%2520State-Owned%2520Gas%2520Company.pdf%3Fdisable_range%3D1%26from_native_print%3D1%26preview%3D1 , Implementing/Intermediary Agency Source","https://global.factiva.com/redir/default.aspx?P=sa&an=KAZAEN0020100929e69t0000a&cat=a&ep=ASE, Media Report, including Wikileaks; https://global.factiva.com/redir/default.aspx?P=sa&an=KAZWIR0020100929e69s000xe&cat=a&ep=ASE, Media Report, including Wikileaks","https://www.google.com/maps/place/Aktau,+Kazakhstan/@43.6593996,51.1057797,11z/data=!3m1!4b1!4m5!3m4!1s0x41b4321732bc75d7:0x7614e1e6630a7769!8m2!3d43.6588079!4d51.1974563","Aktau district is coded for this project (note that the GADM layer has a different spelling - Aqtau). The asphalt plant that received money for construction is located in this area, but the exact location of the plant could not be found using google maps","good","district",51.35,43.5,"Aqtau","Assembly","KAZ.6.1_1","Kazakhstan"
55030,"Bank of China provides two loans worth a combined $208 million USD to refinance 2010 loan to JV Caspi Bitum LLP (Linked to Project ID#40265 and #73404)","On September 28, 2010, the Bank of China (BOC) signed a $232 million USD loan agreement with JV Caspi Bitum LLP, a Kazakh-Chinese joint venture between Kazakhstan Petrochemical Industries JSC and CITIC Kazakhstan LLP, for the construction of a bitumen (asphalt) plant in Aktau, captured by linked project ID#40265 (see ""Bank of China to provide $232 ml loan to finance construction of an asphalt plant in Aktau""). CITIC Kazakhstan also contributed $29 million USD for this project, as captured by linked project ID#73404.

Then, on June 17, 2016, JV Caspi Bitum LLP entered into two additional loan agreements with BOC in an aggregate principal amount of $208 million USD, to refinance the 2010 loan. The funds were drawn down and the 2010 loan was fully repaid as of 2018 (see pg.109 of ""JSC NC “KazMunayGas” 2018 Base Prospectus"").

STAFF_NOTE: AidData did not include a transaction amount so as to avoid double-counting with the 2010 loan. Additionally, normally AidData would create two separate projects to capture each loan However, because they were signed on the same day, and no information on the new terms could be found, AidData has elected to let this project count for both.","Action Relating to Debt","http://kase.kz/files/emitters/KMGZ/kmgzf4_2018_eng.pdf, Implementing/Intermediary Agency Source; https://global.factiva.com/redir/default.aspx?P=sa&an=KAZAEN0020100929e69t0000a&cat=a&ep=ASE, Media Report, including Wikileaks; https://global.factiva.com/redir/default.aspx?P=sa&an=KAZWIR0020100929e69s000xe&cat=a&ep=ASE, Media Report, including Wikileaks","https://global.factiva.com/redir/default.aspx?P=sa&an=KAZAEN0020100929e69t0000a&cat=a&ep=ASE, Media Report, including Wikileaks; https://global.factiva.com/redir/default.aspx?P=sa&an=KAZWIR0020100929e69s000xe&cat=a&ep=ASE, Media Report, including Wikileaks","http://kase.kz/files/emitters/KMGZ/kmgzf4_2018_eng.pdf","The Bank of China provided a loan to refinance the construction of a bitumen factory in Aktau. I coded the ADM2.","good","district",51.35,43.5,"Aqtau","Assembly","KAZ.6.1_1","Kazakhstan"
53553,"China Development Bank provides a $2 billion USD loan for the Atyrau Petrochemical Complex Construction Project (Linked to Project ID#40266)","In 2009, Kazakhstan Petrochemical Industries (KPI) LLP signed an Engineering, Procurement, and Construction (EPC) contract with Sinopec Engineering Co., Ltd. (through Sinopec Group subsidiary China Petroleum & Chemical Corporation) for the first stage of construction of Atyrau petrochemical project (see ""哈萨克斯坦石油加工领域发展和炼厂改造情况"" and ""Sinopec to build gas chemicals plant in Kazakhstan""). On February 22, 2011, the Development Bank of Kazakhstan JSC (DBK) entered into a $1.4 billion USD credit agreement with the Export-Import Bank of China to finance the construction of an integrated petrochemical project in the Atyrau Region of Kazakstan. However, as of 2017, no amounts had been drawn down under this credit agreement (see pg.67 of ""Development Bank of Kazakhstan Base Prospectus 2017""). This was due to the mutual termination of the EPC contract between KPI and Sinopec in 2014 (see ""Polypropylene plant will be built by the Chinese, but not by Sinopec Engineering""). Therefore, AidData has assumed that the China Eximbank loan was cancelled (since the proceeds of this loan were to be used to fund the EPC contract with Sinopec). For this cancelled loan, see linked project ID#40266.

Then on, December 2015, China National Chemical Engineering Corporation (CNCEC) signed a contract to construct an integrated gas-chemical complex in the Atyrau Region on a turnkey basis (see ""Kazakhstan intends to continue construction of PP production in Atyrau...""). Then, on September 3, 2016, China Development Bank (Xinjiang Branch) (CDB) signed a $2 billion USD loan agreement with KPI for the construction of the complex (see ""Atyrau Petrochemical Complex""). The loan carried the following terms: a maturity period of 20 years and an interest rate of 5.8%. National Welfare Fund Samruk-Kazyna JSC provided a guarantee for this loan on February 13, 2017. On November 24, 2017, CDB sent an advance payment of $409 million USD to CNCEC (see ""Technopark phase""). The project had a total cost of $2.6 billion USD; the CDB bank covered the entire cost of the $1.795 billion USD EPC contract with CNCEC; the remainder of the financing of the project was provide by its organizers of the project; KPI and its ownership (see ""Kazakhstan intends to continue construction of PP production in Atyrau..."").

KPI was the project company (special purpose vehicle) responsible for the financing, design, and construction of the Atyrau Petrochemical Complex Construction Project. KPI was 99% owned by United Chemical Company LLP, a subsidiary of JSC Sovereign Wealth Fund Samruk-Kazyna; the remaining 1% of KPI LLP was owned by a private investor, ""Firm Almex Plus” LLP (see ""About company""). Almex reportedly had a 49% ownership in November 2017, but this was either incorrect, or an indication that it sold the majority of its shares to United Chemical Company LLP (see ""Kazakhstan intends to continue construction of PP production in Atyrau..."").

42 construction and installation companies were involved in the construction and installation work; 39 of which were Kazakhstani and 3 of which were foreign. The Kazakhstani companies included AtyrauNefteMash LLP, which produced the propane and propylene splitter, ""Petropavlovsk Plant of Heavy Machine Building"" JSC and Sewon-Vertex Heavy Industries received orders for the production of 35 units and heat exchangers with a total weight  (see ""Қазақстандық компаниялар мұнай-химия зауытын салуға қатысады ма""). Imstalcon JSC participated in the manufacture of equipment for the project, while the Kazakh Institute of Oil and Gas JSC participated in the design of the complex (see ""Integrated Gas Chemical Complex Construction Update""). Chicago Bridge & Iron Company (CB&I) received the PMC contract for project management (see ""History of the company""). The project was transferred from Samruk-Kazyna to the trust management of JSC NC KazMunayGas (KMG) in June 2018 (see ""Integrated Gas Chemical Complex Construction Update"").

Upon completion, the petrochemical complex was expected to produce 500,000 tons of polypropylene per year and be the first integrated gas-chemical complex in Kazakhstan (see ""White & Case Advises Kazakhstan Petrochemical Industries...""). The plant was expected to go online in 2020 (see ""中国国家开发银行与哈萨克斯坦石油化学工业公司签署阿特劳天然气化工项目第一阶段建设融资协议""). On November 27, 2017, KPI sent a notice of the start of construction work to the general contractor (see ""Technopark phase""). The message was received and work began on December 11, 2017 (see ""CB&I Gets Go-ahead for Kazakhstan Petchem Project""). In October 2020, the project was 77% complete and expected to be complete in 2021 (see ""Large petrochemical complex to be launched in western Kazakhstan in 2021"").

STAFF_NOTE: This project is sometimes referred to as ""Construction of the first integrated gas chemical complex in Atyrau oblast,"" ""Construction of an integrated gas chemical complex in the Atyrau region - the first phase (polypropylene), or ""Integrated Gas Chemical Complex (Phase I – polypropylene production).""

The complex is located in the National Industrial Petrochemical Technopark Special Economic Zone (see ""Technopark phase""). The special economic zone is 33 km to the northeast of the city of Atyrau, and 8-9 km north to north of Karabatan (see ""Kazakhstan Petrochemical Industries Inc. Ltd""). More detailed locational information can be found at http://www.wraconferences.com/wp-content/uploads/2016/12/10.10-Raushan-Samurzina-eng.pdf","Industry, Mining, Construction","https://m.nationalbank.kz/cont/BoP_2017_eng.pdf, Government Source (Donor/Recipient); https://global.factiva.com/redir/default.aspx?P=sa&an=KAZNAE0020160904ec940005p&cat=a&ep=ASE, Media Report, including Wikileaks; https://www.dropbox.com/s/dil9222kl0ts6il/IJGlobal%20-%20Atyrau%20Petrochemical%20Complex%20-%20Kazakhstan.pdf?dl=0, NGO/Civil Society/Advocacy; https://www.polyestertime.com/kazakhstan-pp-production-atyrau/, Media Report, including Wikileaks; https://www.netherlandsworldwide.nl/.../energy-issue-december-2017-kazakhstan/Ene..., Other Official Source (non-Donor, non-Recipient); https://www.whitecase.com/news/white-case-advises-kazakhstan-petrochemical-industries-development-2-billion-petrochemical, Media Report, including Wikileaks; https://web.archive.org/web/20190404113718/https://www.globuc.com/2019/02/15/overview-of-the-largest-downstream-projects-in-central-asia/#kazah, NGO/Civil Society/Advocacy; https://web.archive.org/web/20200625221420/http://www.mofcom.gov.cn/article/i/jyjl/e/201609/20160901391312.shtml, Government Source (Donor/Recipient); https://www.whitecase.com/news/white-case-advises-kazakhstan-petrochemical-industries-development-2-billion-petrochemical, Media Report, including Wikileaks; https://www.polyestertime.com/kazakhstan-pp-production-atyrau/, Media Report, including Wikileaks; http://www.sat.kz/en/about/our_activity/petrochemistry/kpi, Implementing/Intermediary Agency Source; https://www.dropbox.com/s/mzlbmprfvqx1j6r/News_--China%20National%20Chemical%20Engineering%20Group%20Corporation.pdf?dl=0, Implementing/Intermediary Agency Source; https://petrocouncil.kz/kk/%D2%9Baza%D2%9Bstandy%D2%9B-kompaniyalar-m%D2%B1naj-himiya-zauytyn-salu%D2%93a-%D2%9Batysady-ma/, Government Source (Donor/Recipient); http://www.wraconferences.com/wp-content/uploads/2016/12/10.10-Raushan-Samurzina-eng.pdf, Media Report, including Wikileaks; https://www.dropbox.com/s/iq0hnht81ri3v49/Technopark%20phase%20-%20kpi.kz.pdf?dl=0, Implementing/Intermediary Agency Source; https://www.dropbox.com/s/y99bx269jx8hfr4/Kazakhstan%2C%20China%20inked%20%242bln%20deals.pdf?dl=0, Media Report, including Wikileaks; https://www.dropbox.com/s/i9m11zkg3wiqv7m/Hallam%20Chow%20_%20People%20_%20Mayer%20Brown.pdf?dl=0, Other; http://data.eastmoney.com/notices/detail/601117/AN202004231378507886,JUU0JUI4JUFEJUU1JTlCJUJEJUU1JThDJTk2JUU1JUFEJUE2.html, Media Report, including Wikileaks; http://www.chinca.org/CICA/info/20010709094711, Other Official Source (non-Donor, non-Recipient); https://ucc.com.kz/wp-content/uploads/2019/05/DO00017_%D0%9A%D0%BE%D0%BD%D1%81%D0%BE%D0%BB%D0%B8%D0%B4%D0%B8%D1%80%D0%BE%D0%B2%D0%B0%D0%BD%D0%BD%D0%B0%D1%8F_%D0%A4%D0%9E_%D0%9C%D0%A1%D0%A4%D0%9E_FINAL_DECEMBER_2018.pdf, Other; https://www.dropbox.com/s/730gdpc1bkd6o30/Company%20History%20-%20United%20Chemical%20Company%20LLP.pdf?dl=0, Implementing/Intermediary Agency Source; https://ucc.com.kz/istorija-kompanii/, Implementing/Intermediary Agency Source; https://www.kpi.kz/ru/press-center/news-and-events/faza-tekhnoparka.html, Implementing/Intermediary Agency Source; https://kpi.kz/en/about-company/, Implementing/Intermediary Agency Source; https://www.rns-pdf.londonstockexchange.com/rns/0289Y_-2017-11-30.pdf, Government Source (Donor/Recipient); http://azh.kz/en/news/view/5049, Media Report, including Wikileaks; http://kz.mofcom.gov.cn/article/ztdy/201210/20121008374197.shtml, Government Source (Donor/Recipient); https://global.factiva.com/redir/default.aspx?P=sa&an=CDENGY0020100405e63p00034&cat=a&ep=ASE, Media Report, including Wikileaks; https://www.rigzone.com/news/cbi_gets_goahead_for_kazakhstan_petchem_project-11-dec-2017-152760-article/, Media Report, including Wikileaks; https://www.kmg.kz/eng/press-centr/press-relizy/?cid=0&rid=233?cid=0&rid=233, Implementing/Intermediary Agency Source; https://www.neweurope.eu/article/large-petrochemical-complex-to-be-launched-in-western-kazakhstan-in-2021/, Media Report, including Wikileaks","https://global.factiva.com/redir/default.aspx?P=sa&an=KAZNAE0020160904ec940005p&cat=a&ep=ASE, Media Report, including Wikileaks; https://global.factiva.com/redir/default.aspx?P=sa&an=CDENGY0020100405e63p00034&cat=a&ep=ASE, Media Report, including Wikileaks","https://www.chemicals-technology.com/projects/kazakhstan_petrochem/","Atyrau division is coded for this project since this is where the gas chemical complex that was funded is located. The exact location of the complex was not found (the source provided in the project description redirects to the main website, not the pdf) but the general area is mentioned in the description and a relative location can be found on the website in the geo source cell.","good","district",52.15,47.02,"Atyrau","Assembly","KAZ.4.1_1","Kazakhstan"
55029,"China Development Bank provides a $409 million USD loan for Methanol and Ammonia Complex Project in National Industrial Petrochemical Technopark Special Economic Zone","On June 8, 2017, China Development Bank (CDB) signed a $409 million USD loan agreement with the United Chemical Company LLP for the production of methanol and ammonia in the National Industrial Petrochemical Technopark Special Economic Zone (SEZ) in the Atyrau Region (see signing date at 'Kazakhstan-China Business Council starts in Kazakhstan'; see loan details at pg.84 of '13th National Report On the implementation of the Extractive Industries...'). United Chemical Company LLP was a subsidiary of JSC National Welfare Fund Samruk-Kazyna JSC (see 'History of Company'). This methanol and ammonia complex was located in the National Industrial Petrochemical Technopark Special Economic Zone (SEZ NIPT), which is 33 km to the northeast of the city of Atyrau, and 8-9 kilometers north of Karabatan. More detailed locational information can be found at http://www.wraconferences.com/wp-content/uploads/2016/12/10.10-Raushan-Samurzina-eng.pdf.","Industry, Mining, Construction","http://lenta.inform.kz/en/kazakhstan-china-business-council-starts-in-kazakhstan_a3034112, Media Report, including Wikileaks; https://web.archive.org/web/20201214225111/http://webcache.googleusercontent.com/search?q=cache:Rdb9i7LZws8J:https://www.sk.kz/press-centre/media/19444/&hl=en&gl=us&strip=0&vwsrc=0, Government Source (Donor/Recipient); http://webcache.googleusercontent.com/search?q=cache:INR_J70lpPYJ:https://business.gov.kz/ru/news/russian/kitayskie-investory-vlozhat-7-mlrd-dollarov-v-kazakhstanskie-proekty.html&hl=en&gl=us&strip=1&vwsrc=0, Media Report, including Wikileaks; https://sk.kz/documents/Samruk%20Kayna%20Teasers.pdf, Implementing/Intermediary Agency Source; https://www.sk.kz/upload/iblock/1ae/1ae186e86a80f82394a9de2113e2344a.pdf, Implementing/Intermediary Agency Source; http://ucc.com.kz/upload/iblock/dbc/%D0%93%D0%BE%D0%B4%D0%BE%D0%B2%D0%BE%D0%B9%20%D0%BE%D1%82%D1%87%D0%B5%D1%82%20%D0%9E%D0%A5%D0%9A%202017.pdf, Implementing/Intermediary Agency Source; https://eiti.org/sites/default/files/documents/english_2017_eiti_report_kazakhstan.pdf, Government Source (Donor/Recipient); https://pavlodar.atameken.kz/en/news/26643, Media Report, including Wikileaks; https://ucc.com.kz/en/history-of-company/, Implementing/Intermediary Agency Source",NA,"http://sezunion.kz/en/component/k2/item/33-spetsialnaya-ekonomicheskaya-zona-natsionalnyj-industrialnyj-neftekhimicheskij-tekhnopark.html","The souce says the SEZ is located in the city of Atyrau. The city of Atyrau is its own ADM2","good","district",52.15,47.02,"Atyrau","Assembly","KAZ.4.1_1","Kazakhstan"
