"project_id","title","description","crs_sector_name","sources","factiva_sources","GEO_sources","GEO_notes","Christian.Notes","level","X","Y","name","name_type","GID","country"
55016,"China Eximbank provides a $796 million USD preferential buyer’s credit loan for the Ceconstruction of the 763 km Taldykorgan-Ust-Kamenogorsk Segment of the Almaty-Oskemen Road Project (Linked to Project ID#54989, #54990, and #54991)","In May 2016, CITIC Construction Co., Ltd. signed a EPC agreement with KazAvtoZhol National Company Joint Stock Company (JSC NC KazAvtoZhol) for the reconstruction of the 763 km Taldykorgan-Ust-Kamenogorsk segment of the 1003 km Almaty-Oskemen road project (see ""Kazakh Reconstruction Project of State-owned Highways"").

Then, in 2017, the Export-Import Bank of China signed a $796 million preferential buyer’s credit (PBC) loan agreement with JSC NC KazAvtoZhol for the Taldykorgan-Ust-Kamenogorsk (763 km) Road Project (see loan value at ""Постановление Правительства 204 17.04.2017...""; see year at pg.14 of ""Financial Statements for the year ended 31 December 2018""; see PBC at ""哈萨克斯坦总理马明视察中国企业承建公路项目""). This loan carried the following terms: a maturity period of 20 years and an interest rate of 2% (see pg.47 of ""Financial Statements for the year ended 31 December 2018""). On April 24, 2017, the Ministry of Finance of the Republic of Kazakhstan provided a sovereign guarantee for this loan on behalf of KazAvtoZhol (see ""Постановление Правительства 204 17.04.2017...""). The loan legally entered into force in June 2017 (see ""Кредитное соглашение по реконструкции автодороги вступило в силу""). The total cost of the project was $936 million USD; co-financers are unknown (see ""哈萨克斯坦总理马明视察中国企业承建公路项目"").

This project involved a reconstruction of a 763 km long segment of Kazakhstan's national highway network, stretching from Taldykorgan, capital of the Almaty Region, to Oskemen (formerly Ust-Kamenogorsk), the administrative center of the East Kazakhstan Region (see pg.46 of ""CITIC Group Annual Report 2018""). The project sought to widen the carriageway by up to 9 meters, allowing the speed limit to be up to 120 km/h. In addition to CITIC Construction, Todini Central Asia LLP and JSC K-Dorstroy performed work on the project (see ""Reconstruction Works on Taldykorgan – Kalbatau – Ust-Kamenogorsk Road km 615-1073 in Eastern-Kazakhstan Oblast""). On June 7, 2017, CITIC Construction accepted an order from the Government of Kazakhstan to commence work (see ""CITIC Construction Sign Multiple Cooperation Documents with Kazakhstan""). The contract period was 54 months. Construction began in November 2017. As of the end of 2018, the project was 8% complete (see pg.46 of ""CITIC Group Annual Report 2018""). The project was expected to be completed in May 2022 (see ""哈萨克斯坦总理马明视察中国企业承建公路项目"").

In 2017, JSC NC KazAvtoZhol signed 4 preferential buyer’s credit (PBC) loan agreements with China Eximbank in 2017 worth $1,667,577,000 USD to support 4 road reconstruction projects: the Kalbatau–Maikapshagai Road Reconstruction Project (captured by linked project ID#54990), the Taldy-Korgan-Kalbatau-Ust-Kamenogorsk Road Reconstruction Project (captured by this project), the Merke-Burylbaital Highway Reconstruction Project (captured by linked project ID#54989), and the Astana Bypass Road Reconstruction Project (see linked project ID#54991) (see that the loans were PBCs at ""哈萨克斯坦总理马明视察中国企业承建公路项目"": see rest at pg.14 of ""Financial Statements for the year ended 31 December 2018""). The projects had the following contributions from Eximbank: $434.5 million USD for the Kalbatau–Maikapshagai Road Reconstruction Project, $796 million USD for the Taldy-Korgan-Kalbatau-Ust-Kamenogorsk Road Reconstruction Project, $253.3 million USD for the Merke-Burylbaital Highway Reconstruction Project, and $183.95 million USD for Astana Bypass Road. The sum of these 4 loans is $1,667,750,000 USD, which is very close to $1,667,577,000 USD figure provided by JSC NC KazAvtoZhol. All four of these loans carried a maturity period of 20 years and an interest rate of 2% (see pg.14 and 47 of ""Financial Statements for the year ended 31 December 2018"").

This is a 763 km road segment along the 1003 km Almaty-Oskemen road project that runs from Taldykorgan to Kalbatau and then to Ust and Kamenogorsk. More locational information can be found at https://web.archive.org/web/20200219065153/http://www.aksuakimat.gov.kz/ru/zhkh_1111.

STAFF_NOTE: Note that Ust-Kamenogorsk is also referred to as Oskemen, and some reports have referred to this road as Taldykorgan-Kalbatau-Öskemen. The Chinese official name for the project is 塔尔迪库尔干- 乌斯季卡缅诺戈尔斯克764 公里国家级公路改造项目. The Russian name of the project is проекту реконструкции автомобильной дороги республиканского значения Талдыкорган – Калбатал - Усть-Каменогорск км 287-1073; another Russian name is Реконструкция автомобильной дороги республиканского значения ""Талдыкорган – Калбатау – Усть-Каменогорск"" км 287-1073. The project is sometimes also referred to in English as the Taldykorgan-Kalbatau-Ust-Kamenogorsk (615-1073 km) Project. TKU Expressway is another alternative name in English.","Transport and Storage","https://web.archive.org/web/20180611124851/https://primeminister.kz/en/news/all/gosprogramma-nurli-zhol-avtomobilnie-dorogi-logistika-zhkh-16616, Government Source (Donor/Recipient); http://www.construction.citic/content/details_47_1844.html, Implementing/Intermediary Agency Source; https://web.archive.org/web/20171225044038/https://www.gtai.de/GTAI/Navigation/DE/Trade/Maerkte/suche,t=china-weitet-engagement-in-kasachstan-aus,did=1806084.html, Other Official Source (non-Donor, non-Recipient); http://www.osce-academy.net/upload/file/CADGAT_21_BRI_Road_and_Rail.pdf, NGO/Civil Society/Advocacy; https://zakon.uchet.kz/rus/docs/P1800000047, Government Source (Donor/Recipient); https://primeminister.kz/ru/decisions/14042017-201, Government Source (Donor/Recipient); http://www.kazautozhol.kz/oldweb/images/Investors/KazAvtoZhol_2018_FS_ENG.pdf, Implementing/Intermediary Agency Source; http://www.construction.citic/content/details_39_2201.html, Implementing/Intermediary Agency Source; http://www.kazautozhol.kz/oldweb/images/Investors/KazAvtoZhol_2018_FS_ENG.pdf, Implementing/Intermediary Agency Source; https://www.dropbox.com/s/5d5y0hhe1xy9wuu/KazAvtoZhol_2018_FS_ENG.pdf?dl=0, Implementing/Intermediary Agency Source; https://primeminister.kz/ru/decisions/14042017-201, Government Source (Donor/Recipient); http://www.kazautozhol.kz/oldweb/index.php/ru/pressa/novosti/item/kreditnoe-soglashenie-po-rekonstruktsii-avtodorogi-vstupilo-v-silu, Implementing/Intermediary Agency Source; https://web.archive.org/web/20200219065153/http://www.aksuakimat.gov.kz/ru/zhkh_1111, Government Source (Donor/Recipient); https://kodeksy-kz.com/norm_akt/source-%D0%9F%D1%80%D0%B0%D0%B2%D0%B8%D1%82%D0%B5%D0%BB%D1%8C%D1%81%D1%82%D0%B2%D0%BE/type-%D0%9F%D0%BE%D1%81%D1%82%D0%B0%D0%BD%D0%BE%D0%B2%D0%BB%D0%B5%D0%BD%D0%B8%D0%B5/204-17.04.2017.htm, Other; https://zakon.uchet.kz/rus/docs/P1800000047, Government Source (Donor/Recipient); http://www.osce-academy.net/upload/file/CADGAT_21_BRI_Road_and_Rail.pdf, NGO/Civil Society/Advocacy; https://www.dropbox.com/s/w10ixeuq591b44u/Kazakh%20Reconstruction%20Project%20of%20State-owned%20Highways%20-%20Major%20projects%20-%20CITIC%20Construction.pdf?dl=0 and https://europe-china.kz/en/news/12427, Implementing/Intermediary Agency Source; https://www.dropbox.com/s/1mht44isl49c23m/40%20Years%20of%20Reform%20and%20Opening-up%20of%20_National%20Human%20History_%20%EF%BD%9C%20Following%20the%20_Belt%20and%20Road_%20Initiative%2C%20_Chinese%20Wisdom_%20Going%20Overseas.pdf?dl=0, Implementing/Intermediary Agency Source; http://construction.citic/en/content/details_39_2498.html, Implementing/Intermediary Agency Source; https://reconnectingasia.csis.org/database/projects/almaty-ust-kamenogorsk-road-rehabilitation/309a30f5-a3b7-4161-a602-95b0453fac6a/, Other; http://www.unece.org/fileadmin/DAM/trans/publications/Report_-_Kazakhstan_as_a_transport_logistics_centre_Europe-Asia.pdf, Other Official Source (non-Donor, non-Recipient); http://lenta.inform.kz/en/e-kazakhstan-joins-western-europe-western-china-intl-transit-corridor_a3043879, Media Report, including Wikileaks; https://www.dropbox.com/s/zm8pd0h9cg61ewa/Kazakhstan%20State%20Highway%20Reconstruction%20Project-Important%20Projects%20by%20Business%20Divisions-CITIC%20Construction.pdf?dl=0, Implementing/Intermediary Agency Source; https://www.citic.com/uploadfile/2019/0418/20190418044143339.pdf, Implementing/Intermediary Agency Source; http://kz.mofcom.gov.cn/article/todayheader/201905/20190502867981.shtml, Government Source (Donor/Recipient); https://zakon.uchet.kz/rus/docs/P1700000201, Government Source (Donor/Recipient)",NA,"","","good","district",79.62,45.84,"Sarkandskiy","District","KAZ.1.13_1","Kazakhstan"
53673,"Chinese Government provides $17.2 million USD for the Chukurbulak Dam Construction Project on the Khorgos River","On June 8, 2017, during the visit of Chinese President Xi Jinping to Kazakhstan, the Chinese Government and the Government of Kazakhstan signed an agreement on the construction of the Chukurbulak («Шұқырбұлақ») dam on the Khorgos River (see ""Negotiations with Xi JInping, Chairman of the People's Republic of China, in expanded format""). The estimated cost of the project was $34.4 million USD (₸11.7 billion KZT) (see ""Kazakhstan, China to construct dam on Khorgos River""). The Chinese Government provided 50% of the financing for the project, or $17.2 million USD, while the Government of Kazakhstan provided the other 50% (see ""Kazakhstan, China to construct dam on Khorgos River""). China was set to own 50% of the dam after completion, while the other half would be property of Kazakhstan (see ""Kazakhstan, China to jointly build dam on Khorgos river""). The Parliament of Kazakhstan ratified the agreement on June 21, 2018 (see ""Kazakhstan's Parliament ratifies agreement with China on construction of dike"").

The mudflow dam was located on Khorgos River 5 kilometers upstream from the Kazakh-Chinese joint Dostyk Hydraulic Power System, in the small town of Dostyk in the Almaty Region on the border with China's Xinjiang Uyghur Autonomous Region. The dam was intended to protect the Khorgos International Center for Cross-Border Cooperation, the Dostyk Hydraulic Power System, the Baskunchi and Khorgos settlements, the Atasu-Alashankou oil pipeline, road and railway bridges, and the people living in the river's lower basin, from mudflows and floods. The Committee for Emergency Situations of Kazakh Ministry of Internal Affairs and Xinjiang Production and Construction Corps were responsible for the dam. Experts from both countries performed cost estimates and created designs for the project. A Kazakh-China committee was to be established to manage the construction process, while the operation and management was to be determined by a later agreement (see ""Kazakhstan, China to construct dam on Khorgos River"").

The construction of the dam included a central reinforced concrete section (featuring the necessary metal structures), an earth part of the dam, a control and measuring system, and a temporary cofferdam and drainage channel for passing water during the construction period, as well as 200-meter shore protection structures (dams) under the dam (see ""Kazakhstan and China to construct dam on Khorgos River""). The dam was designed to intercept mudflows of up to 9.8 million cubic meters (see ""Kazakh-Chinese dam to protect ICBC Khorgos""). Part of the dam was located on Chinese territory (see ""ПОЗДРАВЛЯЕМ!""). Construction began on April 18, 2019 (see ""АЛМАТЫ ОБЛЫСЫНЫҢ ҚОРҒАС ӨЗЕНІНДЕ «ШҰҚЫРБҰЛАҚ»..."").

STAFF_NOTE: The Kazakh name of this project is «Шұқырбұлақ» (Алмалы) бірлескен қазақстан-қытай сел ұстайтын бөгетінің құрылысын. No source states that China gave $17.2 million USD; AidData took this number by dividing the estimated project cost of $34.4 million USD in half.  ""Flow type"" is likely a grant, but no source has corroborated that; therefore, it was coded as ""Vague TBD.""","Water Supply and Sanitation","http://kz2.mofcom.gov.cn/article/chinanews/201805/20180502750223.shtml, Government Source (Donor/Recipient); https://bnews.kz/en/news/kazakhstan_and_china_to_construct_dam_on_khorgos_river, Media Report, including Wikileaks; http://lenta.inform.kz/en/kazakh-chinese-dam-to-protect-icbc-khorgos_a3035179, Media Report, including Wikileaks; https://en.trend.az/business/economy/2919711.html, Media Report, including Wikileaks; http://www.akorda.kz/en/events/akorda_news/meetings_and_receptions/negotiations-with-xi-jinping-chairman-of-the-peoples-republic-of-china-in-expanded-format, Government Source (Donor/Recipient); https://astanatimes.com/2018/07/kazakhstan-china-to-construct-dam-on-khorgos-river/, Media Report, including Wikileaks; http://mail.icwc-aral.littel.uz/yearbook/pdf/05_yearbook2018_en.pdf, Government Source (Donor/Recipient); https://web.archive.org/web/20190422101106/http://emer.gov.kz/kz/59194-almaty-oblysyny-or-as-zeninde-sh-yrb-la-birlesken-aza-stan-ytaj-sel-stajtyn-b-getini-rylysyn-bastau-r-simi-tti, Government Source (Donor/Recipient); https://kaztag.info/en/news/kazakhstan-s-parliament-ratifies-agreement-with-china-on-construction-of-dike, Media Report, including Wikileaks; https://www.kt.kz/eng/society/kazakhstan_and_china_to_construct_dam_on_khorgos_river_1153657495.html, Media Report, including Wikileaks; https://www.facebook.com/426974090985290/posts/1281337158882308/, Social Media, including Unofficial Blogs",NA,"https://www.kt.kz/eng/society/kazakhstan_and_china_to_construct_dam_on_khorgos_river_1153657495.html, https://www.google.com/search?q=khorgos+river&sxsrf=ALeKk03zidpsSqOrrR_NipaoBBNgSOpJOg:1617758119307&tbm=isch&source=iu&ictx=1&fir=hhvJlB-rvv_v2M%252Cn-WpewtBp_qbJM%252C_&vet=1&usg=AI4_-kTxuVG2jl7MW_JiR_M9OkyvucYKAg&sa=X&ved=2ahUKEwjB66HQ-urvAhX8ElkFHQTBBmgQ9QF6BAgLEAE#imgrc=hhvJlB-rvv_v2M","The maps and other location details make it appear that the Dam is located in Alakolskiy District. While it is called Chukurbulak Dam, the city appears to nowhere near the river while other sources name it upstream of Dostyk Hydraulic Power System. ","good","district",80.13,46.24,"Alakolskiy","District","KAZ.1.2_1","Kazakhstan"
55016,"China Eximbank provides a $796 million USD preferential buyer’s credit loan for the Ceconstruction of the 763 km Taldykorgan-Ust-Kamenogorsk Segment of the Almaty-Oskemen Road Project (Linked to Project ID#54989, #54990, and #54991)","In May 2016, CITIC Construction Co., Ltd. signed a EPC agreement with KazAvtoZhol National Company Joint Stock Company (JSC NC KazAvtoZhol) for the reconstruction of the 763 km Taldykorgan-Ust-Kamenogorsk segment of the 1003 km Almaty-Oskemen road project (see ""Kazakh Reconstruction Project of State-owned Highways"").

Then, in 2017, the Export-Import Bank of China signed a $796 million preferential buyer’s credit (PBC) loan agreement with JSC NC KazAvtoZhol for the Taldykorgan-Ust-Kamenogorsk (763 km) Road Project (see loan value at ""Постановление Правительства 204 17.04.2017...""; see year at pg.14 of ""Financial Statements for the year ended 31 December 2018""; see PBC at ""哈萨克斯坦总理马明视察中国企业承建公路项目""). This loan carried the following terms: a maturity period of 20 years and an interest rate of 2% (see pg.47 of ""Financial Statements for the year ended 31 December 2018""). On April 24, 2017, the Ministry of Finance of the Republic of Kazakhstan provided a sovereign guarantee for this loan on behalf of KazAvtoZhol (see ""Постановление Правительства 204 17.04.2017...""). The loan legally entered into force in June 2017 (see ""Кредитное соглашение по реконструкции автодороги вступило в силу""). The total cost of the project was $936 million USD; co-financers are unknown (see ""哈萨克斯坦总理马明视察中国企业承建公路项目"").

This project involved a reconstruction of a 763 km long segment of Kazakhstan's national highway network, stretching from Taldykorgan, capital of the Almaty Region, to Oskemen (formerly Ust-Kamenogorsk), the administrative center of the East Kazakhstan Region (see pg.46 of ""CITIC Group Annual Report 2018""). The project sought to widen the carriageway by up to 9 meters, allowing the speed limit to be up to 120 km/h. In addition to CITIC Construction, Todini Central Asia LLP and JSC K-Dorstroy performed work on the project (see ""Reconstruction Works on Taldykorgan – Kalbatau – Ust-Kamenogorsk Road km 615-1073 in Eastern-Kazakhstan Oblast""). On June 7, 2017, CITIC Construction accepted an order from the Government of Kazakhstan to commence work (see ""CITIC Construction Sign Multiple Cooperation Documents with Kazakhstan""). The contract period was 54 months. Construction began in November 2017. As of the end of 2018, the project was 8% complete (see pg.46 of ""CITIC Group Annual Report 2018""). The project was expected to be completed in May 2022 (see ""哈萨克斯坦总理马明视察中国企业承建公路项目"").

In 2017, JSC NC KazAvtoZhol signed 4 preferential buyer’s credit (PBC) loan agreements with China Eximbank in 2017 worth $1,667,577,000 USD to support 4 road reconstruction projects: the Kalbatau–Maikapshagai Road Reconstruction Project (captured by linked project ID#54990), the Taldy-Korgan-Kalbatau-Ust-Kamenogorsk Road Reconstruction Project (captured by this project), the Merke-Burylbaital Highway Reconstruction Project (captured by linked project ID#54989), and the Astana Bypass Road Reconstruction Project (see linked project ID#54991) (see that the loans were PBCs at ""哈萨克斯坦总理马明视察中国企业承建公路项目"": see rest at pg.14 of ""Financial Statements for the year ended 31 December 2018""). The projects had the following contributions from Eximbank: $434.5 million USD for the Kalbatau–Maikapshagai Road Reconstruction Project, $796 million USD for the Taldy-Korgan-Kalbatau-Ust-Kamenogorsk Road Reconstruction Project, $253.3 million USD for the Merke-Burylbaital Highway Reconstruction Project, and $183.95 million USD for Astana Bypass Road. The sum of these 4 loans is $1,667,750,000 USD, which is very close to $1,667,577,000 USD figure provided by JSC NC KazAvtoZhol. All four of these loans carried a maturity period of 20 years and an interest rate of 2% (see pg.14 and 47 of ""Financial Statements for the year ended 31 December 2018"").

This is a 763 km road segment along the 1003 km Almaty-Oskemen road project that runs from Taldykorgan to Kalbatau and then to Ust and Kamenogorsk. More locational information can be found at https://web.archive.org/web/20200219065153/http://www.aksuakimat.gov.kz/ru/zhkh_1111.

STAFF_NOTE: Note that Ust-Kamenogorsk is also referred to as Oskemen, and some reports have referred to this road as Taldykorgan-Kalbatau-Öskemen. The Chinese official name for the project is 塔尔迪库尔干- 乌斯季卡缅诺戈尔斯克764 公里国家级公路改造项目. The Russian name of the project is проекту реконструкции автомобильной дороги республиканского значения Талдыкорган – Калбатал - Усть-Каменогорск км 287-1073; another Russian name is Реконструкция автомобильной дороги республиканского значения ""Талдыкорган – Калбатау – Усть-Каменогорск"" км 287-1073. The project is sometimes also referred to in English as the Taldykorgan-Kalbatau-Ust-Kamenogorsk (615-1073 km) Project. TKU Expressway is another alternative name in English.","Transport and Storage","https://web.archive.org/web/20180611124851/https://primeminister.kz/en/news/all/gosprogramma-nurli-zhol-avtomobilnie-dorogi-logistika-zhkh-16616, Government Source (Donor/Recipient); http://www.construction.citic/content/details_47_1844.html, Implementing/Intermediary Agency Source; https://web.archive.org/web/20171225044038/https://www.gtai.de/GTAI/Navigation/DE/Trade/Maerkte/suche,t=china-weitet-engagement-in-kasachstan-aus,did=1806084.html, Other Official Source (non-Donor, non-Recipient); http://www.osce-academy.net/upload/file/CADGAT_21_BRI_Road_and_Rail.pdf, NGO/Civil Society/Advocacy; https://zakon.uchet.kz/rus/docs/P1800000047, Government Source (Donor/Recipient); https://primeminister.kz/ru/decisions/14042017-201, Government Source (Donor/Recipient); http://www.kazautozhol.kz/oldweb/images/Investors/KazAvtoZhol_2018_FS_ENG.pdf, Implementing/Intermediary Agency Source; http://www.construction.citic/content/details_39_2201.html, Implementing/Intermediary Agency Source; http://www.kazautozhol.kz/oldweb/images/Investors/KazAvtoZhol_2018_FS_ENG.pdf, Implementing/Intermediary Agency Source; https://www.dropbox.com/s/5d5y0hhe1xy9wuu/KazAvtoZhol_2018_FS_ENG.pdf?dl=0, Implementing/Intermediary Agency Source; https://primeminister.kz/ru/decisions/14042017-201, Government Source (Donor/Recipient); http://www.kazautozhol.kz/oldweb/index.php/ru/pressa/novosti/item/kreditnoe-soglashenie-po-rekonstruktsii-avtodorogi-vstupilo-v-silu, Implementing/Intermediary Agency Source; https://web.archive.org/web/20200219065153/http://www.aksuakimat.gov.kz/ru/zhkh_1111, Government Source (Donor/Recipient); https://kodeksy-kz.com/norm_akt/source-%D0%9F%D1%80%D0%B0%D0%B2%D0%B8%D1%82%D0%B5%D0%BB%D1%8C%D1%81%D1%82%D0%B2%D0%BE/type-%D0%9F%D0%BE%D1%81%D1%82%D0%B0%D0%BD%D0%BE%D0%B2%D0%BB%D0%B5%D0%BD%D0%B8%D0%B5/204-17.04.2017.htm, Other; https://zakon.uchet.kz/rus/docs/P1800000047, Government Source (Donor/Recipient); http://www.osce-academy.net/upload/file/CADGAT_21_BRI_Road_and_Rail.pdf, NGO/Civil Society/Advocacy; https://www.dropbox.com/s/w10ixeuq591b44u/Kazakh%20Reconstruction%20Project%20of%20State-owned%20Highways%20-%20Major%20projects%20-%20CITIC%20Construction.pdf?dl=0 and https://europe-china.kz/en/news/12427, Implementing/Intermediary Agency Source; https://www.dropbox.com/s/1mht44isl49c23m/40%20Years%20of%20Reform%20and%20Opening-up%20of%20_National%20Human%20History_%20%EF%BD%9C%20Following%20the%20_Belt%20and%20Road_%20Initiative%2C%20_Chinese%20Wisdom_%20Going%20Overseas.pdf?dl=0, Implementing/Intermediary Agency Source; http://construction.citic/en/content/details_39_2498.html, Implementing/Intermediary Agency Source; https://reconnectingasia.csis.org/database/projects/almaty-ust-kamenogorsk-road-rehabilitation/309a30f5-a3b7-4161-a602-95b0453fac6a/, Other; http://www.unece.org/fileadmin/DAM/trans/publications/Report_-_Kazakhstan_as_a_transport_logistics_centre_Europe-Asia.pdf, Other Official Source (non-Donor, non-Recipient); http://lenta.inform.kz/en/e-kazakhstan-joins-western-europe-western-china-intl-transit-corridor_a3043879, Media Report, including Wikileaks; https://www.dropbox.com/s/zm8pd0h9cg61ewa/Kazakhstan%20State%20Highway%20Reconstruction%20Project-Important%20Projects%20by%20Business%20Divisions-CITIC%20Construction.pdf?dl=0, Implementing/Intermediary Agency Source; https://www.citic.com/uploadfile/2019/0418/20190418044143339.pdf, Implementing/Intermediary Agency Source; http://kz.mofcom.gov.cn/article/todayheader/201905/20190502867981.shtml, Government Source (Donor/Recipient); https://zakon.uchet.kz/rus/docs/P1700000201, Government Source (Donor/Recipient)",NA,"","","good","district",80.13,46.24,"Alakolskiy","District","KAZ.1.2_1","Kazakhstan"
