"project_id","title","description","crs_sector_name","sources","factiva_sources","GEO_sources","GEO_notes","Christian.Notes","level","X","Y","name","name_type","GID","country"
73476,"China National Petroleum Corporation provides $95.08 million USD for the construction of the Kazakh National Academy of Choreography","On December 4, 2013, China National Petroleum Corporation (CNPC) signed a memorandum with the Kazakhstani Ministry of Education and Science for the establishment of the Kazakh National Academy of Choreography in Astana (see ""乐玉成大使出席哈萨克斯坦教育和科学部长与各国驻哈使节座谈会""). CNPC provided funds for the academy at the request of President of Kazakhstan Nursultan Nazarbayev as a gift for the 25th anniversary of Kazakhstan's independence (see ""Kazakhstan opens Central Asia's first graduate dance school""). CNPC provided $95.08 million USD for the academy (pg.66 of ""2016 China National Petroleum Corporation Corporate Social Responsibility Report""). The construction of the academy had a total cost of $153 million USD; Kazakhstani-state owned National Welfare Fund Samruk-Kazyna JSC provided the remaining $58 million USD (see ""Oil major puts dance in spotlight"").

Some of the funds provided by CNPC were used on the construction of the main stage of the Astana Ballet Theater, which included a 783-seat auditorium and a modern and innovative lighting system for performance. The academy consisted of a school building, an office building, a residential building, and the Astana Ballet Theater (see ""Oil major puts dance in spotlight""). The educational building had classrooms, a teachers’ room, an indoor garden, a cafeteria, a library, a sports hall, and other rooms. There were 21 rehearsal rooms. The residential building consisted  of dormitories and rent-free staff apartments (see ""Kazakhstan opens Central Asia's first graduate dance school""). The academy had an area of 9.5 hectares (see ""Благотворительность"").

The academy was the first institution of higher education in Central Asia to have a full cycle of choreographic education (see ""Kazakh National Academy of Choreography""). The academy was designated as a national institution of higher education. It had programs ranging from the basics of dance and ballet training to master’s and doctoral programs (see ""Kazakh National Academy of Choreography Opens in Astana""). The academy taught classical ballet, traditional Kazakh dance, and modern dance. Once the students were enrolled, the Government of Kazakhstan would cover all expenses (see ""Oil major puts dance in spotlight"").

Kazakhstani construction company Bazis-A was responsible for project implementation (see ""KAZAKH NATIONAL CHOREOGRAPHY ACADEMY BUILT AT EXPENSE OF EXTRA-BUDGETARY FUNDS""). Swedish company Gustafs Scandinavia AB and Russian firm Eurostroysoyuz provided materials and designs for the interior of the theatre (see ""Kazakh National Academy of Choreography""). Construction had begun by June 2014, and the school was expected to be open in April 2016 (see ""National Academy of Choreography to Open in 2016 in EXPO Complex""). President Nazarbayev opened the academy on August 31, 2016 (see ""Kazakhstan opens Central Asia's first graduate dance school"").

CNPC later donated ₸10 million KZT ($27,117 USD) in 2018 to help finance the academy's purchase medical rehabilitation facilities (see ""Oil major puts dance in spotlight"").

STAFF_NOTE: The Chinese name of the academy is 哈萨克斯坦国家舞蹈学院. A Chinese project title (using an alternative version of the school name) is 阿斯塔纳兴建国立舞蹈学院的工作. The Chinese name of the agreement signed in December 2013 was《关于在阿斯塔纳建设民族舞蹈与芭蕾舞学院的备忘录》. There are many alternative names for the academy in English. They include the National Academy of Dance, the High School of Choreography, the Higher School of National Dance and Ballet, the Astana National Dance Academy, and the National Dance Academy of Kazakhstan.

No source used the phrase ""donated"" or ""granted"" to describe CNPC's contribution, instead they used ""provided"" or ""invested""; however, concerning the nature of this project, the flow type was clearly a grant and was coded as such. ""Year uncertain"" box was checked because the memorandum signed in December 2013 may have been a memorandum of understanding, and therefore not a complete commitment. 2013 remained the commitment year in the absence of another instance of an agreement made in a different year.

The Kazakh National Academy of Choreography was located in Astana (now Nur-Sultan). More detailed locational information can be found at: https://balletacademy.edu.kz/en/home-en/.","Education","https://www.cnpc.com.cn/en/Kazakhstan/country_index.shtml, Implementing/Intermediary Agency Source; http://csr.cnpc.com.cn/cnpccsr/xhtml/PageAssets/2016csr_en.pdf, Implementing/Intermediary Agency Source; http://www.cnpc.com.cn/en/csr2014enhmshn/202006/779fa7719f424936a43f2c75f9259053/files/4d153a205a1947bb88b678a2db2872d2.pdf, Implementing/Intermediary Agency Source; http://www.cnpc-amg.kz/?p=vnesh_blag, Implementing/Intermediary Agency Source; https://astanatimes.com/2016/09/kazakh-national-academy-of-choreography-opens-in-astana/, Media Report, including Wikileaks; https://www.efe.com/efe/english/life/kazakhstan-opens-central-asia-s-first-graduate-dance-school/50000263-3028064, Media Report, including Wikileaks; https://strategy2050.kz/en/news/38408/, Government Source (Donor/Recipient); https://www.inform.kz/en/cnpc-to-produce-large-diameter-pipes-in-kazakhstan_a2813054, Media Report, including Wikileaks; https://www.petroleumjournal.kz/index.php?p=article&aid1=86&aid2=443&id=1037&outlang=3, Media Report, including Wikileaks; https://www.kazpravda.kz/en/multimedia/view/nazarbayev-discussed-export-of-kazakhstan-gas-to-china-with-cnpc-head/, Media Report, including Wikileaks; https://www.chinadailyhk.com/articles/248/221/107/1536217411343.html, Media Report, including Wikileaks; https://www.fmprc.gov.cn/mfa_eng/wjb_663304/zwjg_665342/zwbd_665378/t1114065.shtml, Government Source (Donor/Recipient); http://kz.china-embassy.org/chn/sgxx/t1112294.htm, Government Source (Donor/Recipient); http://kz.china-embassy.org/chn/dszc/dshd/t1595189.htm, Government Source (Donor/Recipient); http://kz.china-embassy.org/chn/sgxx/t1199315.htm, Government Source (Donor/Recipient); http://kz.china-embassy.org/chn/ztbd/XJPZXFWHSKST/t1073661.htm, Government Source (Donor/Recipient); https://www.fmprc.gov.cn/web/gjhdq_676201/gj_676203/yz_676205/1206_676500/1206x2_676520/t1105947.shtml, Government Source (Donor/Recipient); http://kz.china-embassy.org/chn/dszc/dshd/t1105943.htm, Government Source (Donor/Recipient); http://www.cnpc-amg.kz/?p=smi_21, Implementing/Intermediary Agency Source; https://astanatimes.com/2014/06/national-academy-choreography-open-2016-expo-complex/, Media Report, including Wikileaks; https://strategy2050.kz/en/news/38412/, Government Source (Donor/Recipient); https://gustafs.com/portfolio-items/kazakh-national-academy-of-choreography/, Implementing/Intermediary Agency Source; https://www.cnpc.com.cn/ru/gysy/hjysh_common.shtml, Implementing/Intermediary Agency Source",NA,"https://balletacademy.edu.kz/en/home-en/; https://www.google.com/maps/place/Uly+Dala+Avenue+9,+Nur-Sultan+020000,+Kazakhstan/@51.1664798,71.398483,11.49z/data=!4m5!3m4!1s0x4245844dc166edab:0x48c5b83591bcc635!8m2!3d51.0981882!4d71.4191325","Coded the Tselinogradskiy/Tselinograd District. Nur-sultan was formerly known as Astana, which is where the Kazakh National Academy of Choreography is located. Was able to find the district it is located in which i coded using QGIS.","good","district",71.3,51.08,"Tselinogradskiy","District","KAZ.2.14_1","Kazakhstan"
43824,"China completes Confucius Institute at Eurasian National University","In July 2005, the President of the Republic of Kazakhstan Nursultan Nazarbayev when meeting with Chairman Hu Jintao proposed intentions to establish Confucius Institute in Kazakhstan. On December 20, 2006, Hanban and Eurasian national university from Kazakhstan signed a cooperation agreement to establish a Confucius Institute with Xi'an International Studies University become Chinese side’s executive body. In August 2007, Xi'an International Studies University and Eurasian National University signed ""Implementation Agreement"" of cooperation in the establishment of Confucius Institute and set up a board of directors of Confucius Institute at Eurasian National University.
December 5th, 2007, Confucius Institute at the Eurasian National University held the opening ceremony. Minister of Education and Science of the Republic of Kazakhstan Zhanseit Tuimebayev, Ambassador Extraordinary and Plenipotentiary of the People’s Republic of China in Kazakhstan Zhang Xiyun and representatives of the governments of Kazakhstan and China attended opening ceremony and made a speech. Tuimebaev said, with becoming closer in the political, economic, cultural and other areas of cooperation with China, Kazakhstan will need more and more well-trained Chinese language personnel. Confucius Institute established in Kazakhstan will make a great contribution promoting bilateral cooperation in various fields.","Education","http://www.hanban.org/confuciousinstitutes/node_6835.htm, Government Source (Donor/Recipient); http://kz.chineseembassy.org/rus/zhgx/t389583.htm, Government Source (Donor/Recipient); https://akipress.com/news:1516/, Media Report, including Wikileaks; http://ic.enu.kz/index.php?option=com_content&view=article&id=76:-2&catid=40:news&Itemid=90&lang=en, Government Source (Donor/Recipient); http://en.people.cn/90001/90781/90879/6316199.html, Media Report, including Wikileaks; http://english.sina.com/china/1/2007/1205/135360.html, Media Report, including Wikileaks",NA,"http://en.people.cn/90001/90781/90879/6316199.html, https://www.google.com/maps/place/L.N.+Gumilyov+Eurasian+National+University/@51.157963,71.4674171,15z/data=!4m2!3m1!1s0x0:0xadf5a64b949943db?sa=X&ved=2ahUKEwj69Kb75urvAhVqKVkFHUYHDbEQ_BIwHHoECC8QBQ","A Confucius Institute was established at Eurasian National University. It is is located in Astanta, which is in the ADM2 of Tselinogradskiy.
","good","district",71.3,51.08,"Tselinogradskiy","District","KAZ.2.14_1","Kazakhstan"
70741,"CDB provides a $73 million USD syndicated loan to refinance JSC Lokomotiv's loan","In 2014, a group of banks, including HSBC Bank and China Development Bank (CDB) provided a $73 million USD syndicated loan to Joint Stock Company (JSC) Lokomotiv to refinance a loan that was previously obtained for the acquisition of 22 electric locomotives. STAFF_NOTE: Because the specific breakdown of this loan syndicate is unknown and it included a non-Chinese institution, the transaction amount has been left blank to avoid capturing non-Chinese financial flows.","Action Relating to Debt","https://www.dropbox.com/s/75ixogw7ft00ra0/-3313-i.pdf?dl=0, Implementing/Intermediary Agency Source; https://www.ebrd.com/work-with-us/projects/psd/ktz-local-currency-loan.html, Other Official Source (non-Donor, non-Recipient); https://www.railways.kz/sites/default/files/godovoy_otchet_2013_0.pdf, Implementing/Intermediary Agency Source; https://dfo.kz/kz/DfoObjects/objects/teaser-view/30917?RevisionId=0&Download=-3313-%D0%B8.pdf&PluginId=30735b3a096446d4adef7ac8c90deecf&ReportId=60234407&ReportNodeId=2, Implementing/Intermediary Agency Source; https://en.wikipedia.org/wiki/JSC_Lokomotiv , Media Report, including Wikileaks",NA,"https://en.wikipedia.org/wiki/JSC_Lokomotiv","A loan was provided to refinance JSC Lokomotiv's loan to build 22 locomotives. The factory and company are located in Astana/Nur-Sultan so I coded the ADM2.","good","district",71.3,51.08,"Tselinogradskiy","District","KAZ.2.14_1","Kazakhstan"
40237,"Bank of China provides a $49.2 million loan to Kazakhtelecom to purchase Huawei equipment","On April 15, 2009, Kazakhtelecom JSC, Kazakhstan's largest fixed-line telecommunication operator, which is 51% owned by Kazakhstani state-owned National Welfare Fund Samruk-Kazyna, the Bank of China (BOC), and Huawei Technologies Co., Ltd. signed tripartite mutual understanding memorandum for the financing of telecommunication development projects in Kazakhstan (see ""Kazakhtelecom (Kazakhstan), Bank of China and Huawei Technologies sign three-side memo""). Then, in 2011, BOC loaned Kazakhtelecom $49.2 million USD to purchase Huawei equipment (see pg.12 of ""Results as of 2011 and 1Q 2012""). Per the loan agreement, BOC transferred the loan proceeds of directly to Huawei (see pg.49 of ""Kazakhtelecom 2011 Annual Report""). Loan details are unknown.

STAFF_NOTE: ""Project status"" was set to ""Completion"" because it appears that the entirety of the funds were disbursed. Some sources claim this was a $25.6 million USD in the first half of 2011 (for example, pg.12 of ""Результаты за 1 полугодие 2011 года""); in all likelihood, this was the first tranche of this larger loan. Kazakhtelecom reported the loan as ₸7,236,607,00 KZT ($49,344,629.18 in USD-2011 terms), but this transaction amount was not used because official sources reported a USD amount and it is highly unlikely that BOC would directly transfer funds denominated in KZT to Huawei (see this loan amount at pg.49 of ""Kazakhtelecom 2011 Annual Report"").","Communications","https://global.factiva.com/redir/default.aspx?P=sa&an=KAZWIR0020090416e54f001b9&cat=a&ep=ASE, Media Report, including Wikileaks; http://www.kase.kz/news/show/1071618, Media Report, including Wikileaks; http://www.kt.kz/eng/economy/kazakhtelecom_bank_of_china_huawei_technologies_signed_memorandum_of_understanding_1153483286.html, Media Report, including Wikileaks; https://telecom.kz/storage/files/_95/66/5d/64/53/95665d64533b8e02f917f0dbdc0c8b36.pdf, Implementing/Intermediary Agency Source; https://telecom.kz/epkt/storage/files/_c1/22/82/75/db/c1228275db49553a1ca1649690b98bbb.pdf, Implementing/Intermediary Agency Source; https://telecom.kz/epkt/storage/files/_7f/4b/16/a6/a5/7f4b16a6a5f7019656a23ea06603c28b.pdf, Implementing/Intermediary Agency Source; https://telecom.kz/storage/files/_95/66/5d/64/53/95665d64533b8e02f917f0dbdc0c8b36.pdf, Implementing/Intermediary Agency Source; https://telecom.kz/en/news/view/5781, Implementing/Intermediary Agency Source","https://global.factiva.com/redir/default.aspx?P=sa&an=KAZWIR0020090416e54f001b9&cat=a&ep=ASE, Media Report, including Wikileaks","https://en.wikipedia.org/wiki/Kazakhtelecom, https://geohack.toolforge.org/geohack.php?pagename=Nur-Sultan&params=51_10_N_71_26_E_region:KZ_type:city","Since the loan was given to Kazakhtelecom, I coded to Nur-Sultan since that is where they are headquartered. Nur-Sultan is located in Tselinogradskiy. I was able to fine the coordinates on wikipedia","good","district",71.3,51.08,"Tselinogradskiy","District","KAZ.2.14_1","Kazakhstan"
54991,"China Eximbank provides a $183.95 million USD preferential buyer’s credit loan for 33 km Astana Bypass Road Reconstruction Project (BRI) (Linked to Project ID#54989, #54990, and #55016)","On May 15, 2017, the Export-Import Bank of China and KazAvtoZhol National Company Joint Stock Company (JSC NC KazAvtoZhol) signed a $183.95 million USD preferential buyer’s credit (PBC) loan agreement for the 33 km Astana Bypass Road Reconstruction Project (also called the 33 km Astana Ring Road Project, the Southwest Astana Bypass Road Reconstruction Project, or the XH33 Project) (see loan value at ""Об утверждении перечня инвестиционных проектов, предлагаемых...""; see PBC at ""哈萨克斯坦总理马明视察中国企业承建公路项目""; see rest at ""新兴集团承接的哈萨克斯坦两段公路改造项目贷款协议签约""). This loan carried the following terms: a maturity period of 20 years and an interest rate of 2% (see pg.47 of ""Financial Statements for the year ended 31 December 2018""). The Government of Kazakhstan provided a sovereign guarantee for this loan (see ""О внесении изменения в постановление Правительства..."").

China XinXing Construction Development Co., Ltd. was the contractor responsible for project implementation (see ""新兴集团承接的哈萨克斯坦两段公路改造项目贷款协议签约""). The project sought to construct the 33 km long southwest bypass of Astana, giving it an asphalt and concrete surface of category I (see pg.38 of ""Logistics and Transport Competitiveness in Kazakhstan""). Once completed, the road would allow freight vehicles to travel around the city, reducing urban traffic and enabling the development of of logistics centers and service facilities along the ring road. Construction began in December 2017 and the road was expected to be fully operational by 2019 (see ""哈萨克斯坦总理马明视察中国企业承建公路项目""). The construction was suspended for a month due to the COVID-19 pandemic; it restarted in May 2020, with an expected handover dating now falling in August 2020 (see ""Feature: Ring road construction resumes as Kazakh capital partially reopens"").

In 2017, JSC NC KazAvtoZhol signed 4 preferential buyer’s credit (PBC) loan agreements with China Eximbank in 2017 worth $1,667,577,000 USD to support 4 road reconstruction projects: the Kalbatau–Maikapshagai Road Reconstruction Project (captured by linked project ID#54990), the Taldy-Korgan-Kalbatau-Ust-Kamenogorsk Road Reconstruction Project (see linked project ID#55016), the Merke-Burylbaital Highway Reconstruction Project (captured by linked project ID#54989), and the Astana Bypass Road Reconstruction Project (captured by this project) (see that the loans were PBCs at ""哈萨克斯坦总理马明视察中国企业承建公路项目"": see rest at pg.14 of ""Financial Statements for the year ended 31 December 2018""). The projects had the following contributions from Eximbank: $434.5 million USD for the Kalbatau–Maikapshagai Road Reconstruction Project, $796 million USD for the Taldy-Korgan-Kalbatau-Ust-Kamenogorsk Road Reconstruction Project, $253.3 million USD for the Merke-Burylbaital Highway Reconstruction Project, and $183.95 million USD for Astana Bypass Road. The sum of these 4 loans is $1,667,750,000 USD, which is very close to $1,667,577,000 USD figure provided by JSC NC KazAvtoZhol. All four of these loans carried a maturity period of 20 years and an interest rate of 2% (see pg.14 and 47 of ""Financial Statements for the year ended 31 December 2018"").

This project supported the construction of a 33 km southwest section of the ring road (bypass road) around the city of Astana -- from the road to the airport to the M36 highway. Further locational details are provided at https://reconnectingasia.csis.org/database/projects/astana-southwest-bypass-road-construction/38a208f4-305f-4a0c-891b-4ab678753cdd/ and page 38 of http://www.unece.org/fileadmin/DAM/trans/publications/Report_-_Kazakhstan_as_a_transport_logistics_centre_Europe-Asia.pdf.

STAFF_NOTE: The Chinese project title is 努尔苏丹市西南环城公路. The Kazakh project title is «Астана қаласының айналма жолы». The Russian project title is Строительство автомобильной дороги Юго-Западный обход города Астаны.","Transport and Storage","https://web.archive.org/web/20180611124851/https://primeminister.kz/en/news/all/gosprogramma-nurli-zhol-avtomobilnie-dorogi-logistika-zhkh-16616, Government Source (Donor/Recipient); https://www.genertec.com.cn/s/8293-22545-102110.html, Implementing/Intermediary Agency Source; http://kz.mofcom.gov.cn/article/t/201807/20180702767861.shtml, Government Source (Donor/Recipient); http://www.sasac.gov.cn/n2588025/n2641611/n4518442/c11103815/content.html, Implementing/Intermediary Agency Source; http://www.government.kz/en/novosti/1015138-development-of-the-astana-agglomeration-discussed-in-the-government-of-the-republic-of-kazakhstan.html, Government Source (Donor/Recipient); https://www.dropbox.com/s/5d5y0hhe1xy9wuu/KazAvtoZhol_2018_FS_ENG.pdf?dl=0, Implementing/Intermediary Agency Source; https://zakon.uchet.kz/rus/docs/P1800000047, Government Source (Donor/Recipient); http://www.kazautozhol.kz/oldweb/images/Investors/KazAvtoZhol_2018_FS_ENG.pdf, Implementing/Intermediary Agency Source; http://www.mofcom.gov.cn/article/i/jyjl/e/201905/20190502867981.shtml , Government Source (Donor/Recipient); http://adilet.zan.kz/kaz/docs/P1300001409, Government Source (Donor/Recipient); https://www.genertec.com.cn/s/8293-22545-102110.html, Implementing/Intermediary Agency Source; http://miid.gov.kz/en/pages/implementation-state-program-nurly-zhol, Government Source (Donor/Recipient); https://zakon.uchet.kz/rus/docs/P1700000201, Government Source (Donor/Recipient); http://www.unece.org/fileadmin/DAM/trans/publications/Report_-_Kazakhstan_as_a_transport_logistics_centre_Europe-Asia.pdf, Other Official Source (non-Donor, non-Recipient); http://www.xinhuanet.com/english/2020-05/06/c_139035041.htm, Media Report, including Wikileaks",NA,"https://reconnectingasia.csis.org/database/projects/astana-southwest-bypass-road-construction/38a208f4-305f-4a0c-891b-4ab678753cdd/","This project was for the 33 km Astana Bypass Road Reconstruction Project. It encircles Astana, so I coded its ADM2.","good","district",71.3,51.08,"Tselinogradskiy","District","KAZ.2.14_1","Kazakhstan"
