project_id,title,description,crs_sector_name,sources,factiva_sources,location_details,GEO_codedUp,GEO_geojsonLink,GEO_sources,GEO_notes,Christian Notes,christian_geojson,level
34627,Chinese Government provides $15 million grant for Teaching Building of the Chinese Language Department and the Guest House of Kabul University Project,"In March 2011, the Chinese Government and the Government of Afghanistan signed an exchange of notes for the Teaching Building of the Chinese Language Department and the Guest House of Kabul University Project. The Chinese Government reportedly committed about $15 million of grant funding for this project. China 19th Metallurgical Corporation (MCC19) was the contractor responsible for project implementation. 

This project began in October 19, 2012. The project was completed on November 30, 2014. It was then officially handed over to the Afghan side on December 23, 2014. The Chinese Language Department is a 3-storey building with a total floor area of 2,053.5 square meters, which is capable of accommodating 200 students to have classes at the same time. The guest house is a 5-storey building with a total floor area of 4,588 square meters, offering 48 dormitories and the supportive facilities for the foreign teachers working at Kabul University. 

STAFF_NOTE: The Chinese project title is 阿富汗喀布尔大学中文系教学楼和招待所项 or 喀富汗喀布尔大学中文系教学楼和招待所项目后的第. This project is located at Kabul University. The locational coordinates of Kabul University are available at https://www.google.com/maps/place/Kabul+University/@34.5173801,69.1337345,17z/data=!3m1!4b1!4m5!3m4!1s0x38d16f2c550c3f59:0xa47b5d537e5b7214!8m2!3d34.5173801!4d69.1359232.
",Education,"http://www.bjreview.com.cn/document/txt/2010-09/01/content_295504.htm, Government Source (Donor/Recipient); http://archive.pajhwok.com/en/2014/12/23/projects-executed-university-campus, Media Report, including Wikileaks; http://news.xinhuanet.com/english/china/2014-12/23/c_133874580_2.htm, Media Report, including Wikileaks; http://af.china-embassy.org/eng/sgxw/t1222618.htm, Government Source (Donor/Recipient); http://www.mccchina.com/ENGLISH/ShowArticle.asp?ArticleID=22446, Implementing/Intermediary Agency Source; https://www.mccchina.com/ENGLISH/ShowArticle.asp?ArticleID=22967, Implementing/Intermediary Agency Source; http://af.mofcom.gov.cn/article/zxhz/201501/20150100879514.shtml, Government Source (Donor/Recipient); http://af.mofcom.gov.cn/article/todayheader/201201/20120107945057.shtml, Government Source (Donor/Recipient); http://www.mcc.com.cn/mcc/_132154/_132568/471292/index.html, Implementing/Intermediary Agency Source; http://af.china-embassy.org/eng/sgxw/t1222961.htm, Government Source (Donor/Recipient); https://www.fmprc.gov.cn/mfa_eng/wjb_663304/zwjg_665342/zwbd_665378/t1719914.shtml , Government Source (Donor/Recipient); https://reliefweb.int/report/afghanistan/remarks-he-yang-jiechi-minister-foreign-affairs-peoples-republic-china-kabul , Government Source (Donor/Recipient); http://www.china.org.cn/world/Off_the_Wire/2015-11/30/content_37199479.htm , Media Report, including Wikileaks; http://af.china-embassy.org/eng/zagx/introduction/t1088794.htm , Government Source (Donor/Recipient); http://af.china-embassy.org/chn/sgxw/t1222619.htm , Government Source (Donor/Recipient); http://yws.mofcom.gov.cn/article/zt_obor/subjecte/201512/20151201214674.shtml , Government Source (Donor/Recipient); https://baike.baidu.com/item/%E5%96%80%E5%B8%83%E5%B0%94%E5%A4%A7%E5%AD%A6 , Media Report, including Wikileaks; http://www.mcc.com.cn/mccen/focus/_325415/341825/index.html , Implementing/Intermediary Agency Source; http://world.people.com.cn/n/2015/0123/c1002-26436945.html , Media Report, including Wikileaks; http://www.mcc.com.cn/mcc/_132154/_132576/225343/index.html , Implementing/Intermediary Agency Source; http://af.chineseembassy.org/chn/sgxw/t1662730.htm, Government Source (Donor/Recipient)",NA,This project is located at Kabul University.,no,https://gist.github.com/abgaddi/243604d65adb878ff37d676a926c9659,"https://www.google.com/maps/place/Kabul+University/@34.5173801,69.1337345,17z/data=!3m1!4b1!4m5!3m4!1s0x38d16f2c550c3f59:0xa47b5d537e5b7214!8m2!3d34.5173801!4d69.1359232 ","Kabul city division is coded for this project since Kabul University, which received the notes, is located in Kabul. the location of the university can be found by searching the name into google maps",good,https://gist.github.com/abgaddi/243604d65adb878ff37d676a926c9659,district
34502,"Chinese Government provides $4.35 million grant for Jamhuriat Hospital Renovation Project (Linked Project ID #34498, #69992, #69993, #54775)","In 2003, the Chinese Government provided a $4.35 million grant for the Jamhuriat Hospital Renovation Project in Kabul. The project involved the reconstruction of approximately 6,000-7,000 square meters of the hospital, the installation of medical examination facilities such as CT-scans and X-rays, the provision of electrocardiogram and blood test instruments, and the installation of an air-conditioning system. 

China Railway Shisiju Group Corporation, which is also known as China Railway 14th Bureau Group Co., Ltd., and China National Complete Plant Import Export Corporation (COMPLANT) were the contractors responsible for project implementation. This project was launched on August 2, 2003. However, the hospital building collapsed in July 2004 during the construction process, killing 6 construction workers and injuring at least 30 others. The construction restarted from March 2007 and the opening ceremony was held on August 16, 2009.

This project is part of the $150 million donation in 2002 (#34498).

STAFF_NOTE: The Chinese project title is 阿富汗共和国医院维修项目.” According to ""Foundation Stone of China-funded Hospital Building Laid in Kabul"", the project is different than project #69993, which was construction on the main hospital building.",Health,"https://global-factiva-com.proxy.wm.edu/redir/default.aspx?P=sa&an=bbcsap0020020715dy7f001jl&cat=a&ep=ASE, Media Report, including Wikileaks; http://www.spokesman.com/stories/2004/jul/28/four-found-dead-in-hospital-rubble/, Media Report, including Wikileaks; http://www.gov.cn/misc/2006-03/31/content_241509.htm, Government Source (Donor/Recipient); http://af2.mofcom.gov.cn/article/bilateralvisits/200411/20041100003858.shtml, Government Source (Donor/Recipient); http://af.mofcom.gov.cn/article/jmxw/201506/20150601004417.shtml, Government Source (Donor/Recipient); https://global-factiva-com.proxy.wm.edu/redir/default.aspx?P=sa&an=RFEUR00020100716e67g00031&cat=a&ep=ASE, Media Report, including Wikileaks; http://moph.gov.af/en/news/jamhuriat-hospital-in-new-building-begins-operation, Government Source (Donor/Recipient); http://www.nbcnews.com/id/38076136/ns/world_news-south_and_central_asia/t/us-fights-china-spends-gain-afghan-foothold/#.VaIwxfmqqko, Media Report, including Wikileaks; http://af.china-embassy.org/eng/zagx/sbgx/t1121317.htm, Government Source (Donor/Recipient); http://af.mofcom.gov.cn/article/zxhz/201501/20150100879514.shtml, Government Source (Donor/Recipient); http://af.china-embassy.org/chn/zagx/ztgk/t1097558.htm, Government Source (Donor/Recipient); https://iwpr.net/global-voices/use-foreign-contractors-called-question, Media Report, including Wikileaks; http://www.sasac.gov.cn/n2588025/n2588124/c4006614/content.html, Government Source (Donor/Recipient); http://af.mofcom.gov.cn/article/jmxw/200307/20030700112163.shtml , Government Source (Donor/Recipient); http://en.people.cn/200408/01/eng20040801_151500.html , Media Report, including Wikileaks; http://news.sohu.com/30/69/news211736930.shtml, Media Report, including Wikileaks; http://af.china-embassy.org/chn/sgxw/t579046.htm, Government Source (Donor/Recipient)","https://global-factiva-com.proxy.wm.edu/redir/default.aspx?P=sa&an=bbcsap0020020715dy7f001jl&cat=a&ep=ASE, Media Report, including Wikileaks; https://global-factiva-com.proxy.wm.edu/redir/default.aspx?P=sa&an=RFEUR00020100716e67g00031&cat=a&ep=ASE, Media Report, including Wikileaks",This hospital was located in Kabul.,no,https://gist.github.com/abgaddi/243604d65adb878ff37d676a926c9659,"https://www.google.com/maps/place/Jamhuriat+Hospital/@34.5254674,69.1689225,15z/data=!4m2!3m1!1s0x0:0xb2238c27edd9b0c2?sa=X&ved=2ahUKEwjM9MDKuNfvAhWOZ80KHbr4APIQ_BIwDXoECB0QBQ","Kabul city division is coded for this project since the hospital that received the reconstruction grant,  Jamhuriat Hospital, is located in Kabul. the location of the hospital can be found by searching the name into google maps",good,https://gist.github.com/abgaddi/243604d65adb878ff37d676a926c9659,district
70861,China provides office equipment to support the post-war reconstruction of Afghanistan government,"On November 14, 2016，Chinese government held the handover ceremony of the office equipment project to assist to the Afghanistan government.

Chinese government pledged to support Afghanistan's post-war reconstruction firmly and hoped that these office equipment can effectively help Afghanistan improve office working conditions and capacity of office buildings. These equipment were worth 200 million yuan.",Government and Civil Society,"http://af.mofcom.gov.cn/article/zxhz/201611/20161101759090.shtml, Government Source (Donor/Recipient); http://www.china.org.cn/world/Off_the_Wire/2016-11/15/content_39702862.htm, Media Report, including Wikileaks",NA,NA,country_level,,,This project is coded up to country level since there was no specific location found where the office equipment was donated to,good code up,,country
53748,China provides $1.4 million in material aid to Afghans Ministry of Interior,"In July 2003, China and Afghanistan's Interim government signed an agreement with China. China will provide the xequipment and vehicles. It's worth 1.4 million US dollar in total, includes 22 Cherokee vehicles. The equipment and vehicles were handed over on June 30, 2004. The communication equipment came from Shandong Weifang Huaguang Communication Co., Ltd. The 22 vehicles came from Beijing Jeep Automobile Co., Ltd.",Government and Civil Society,"http://af.mofcom.gov.cn/article/jmxw/200407/20040700243063.shtml, Government Source (Donor/Recipient)",NA,NA,no,https://gist.github.com/abgaddi/b6ad566917035d7b033b8c2d3eed0aea,"https://www.google.com/maps/place/Central+Base+and+Special+Force+HQ+(Ministry+of+Interior+Affairs))/@34.5784406,69.1818215,14.97z/data=!4m5!3m4!1s0x38d16e6dbc9407a7:0xdd139f0a32503352!8m2!3d34.5823822!4d69.1786803","Dih Sabz division is coded for this project since the HQ of the Ministry of Affairs, which received the vehicles donation, is located in this division. The location can be found by searching google maps",good,https://gist.github.com/abgaddi/b6ad566917035d7b033b8c2d3eed0aea,district
37865,China provides anti-terrorism and anti-drug training to police officers of Afghanistan (Linked to Project ID#37849),"On 28 October 2014, China announced that it would hold training on anti-terrorism and anti-drugs for Afghanistan. The announcement was made during Afghan's President Mohammad Ashraf Ghani Ahmadzai visit to China. On the same date the announcement was made, China and Afghanistan signed an agreement on economic and technical cooperation, under which China would provide 2 billion Chinese Yuan in grant (See Project ID#37849). China previously had been providing small-scale security training to Afghanistan, specifically in the form of mine clearance and counter-narcotics training. In January 2015, the Xinjiang Frontier Corps and the Xinjiang Police College hosted the first Afghan anti-drug and anti-terrorism training seminar. The training was concluded on 29 January 2015 at Urumqi, Xinjiang. 50 police officers from the Afghanistan Interior Ministry Anti-drug, Anti-terrorism, and Border authorities Department participated in the training that lasted a month, and were later awarded the certificate of completion by the People's Republic of China Ministry of Public Security and the Ministry of Commerce.",Other Multisector,"http://af.mofcom.gov.cn/article/tbbd/201501/20150100856996.shtml, Government Source (Donor/Recipient); https://global-factiva-com.libproxy1.nus.edu.sg/redir/default.aspx?P=sa&NS=18&AID=9NAT002200&an=XNEWS00020141031eaav007bx&cat=a&ep=ASI, Media Report, including Wikileaks; http://www.lowyinstitute.org/publications/chinas-foreign-policy-afghanistan, Academic Journal Article; http://cpc.people.com.cn/n/2014/1101/c64094-25951221.html, Media Report, including Wikileaks; http://news.xinhuanet.com/politics/2014-10/31/c_1113065585.htm, Media Report, including Wikileaks; http://www.chinagabf.com/xbfjcb/html/Qnews/?ID=10812, Other Official Source (non-Donor, non-Recipient); http://difang.gmw.cn/xj/2015-02/01/content_14706457.htm, Media Report, including Wikileaks","https://global-factiva-com.libproxy1.nus.edu.sg/redir/default.aspx?P=sa&NS=18&AID=9NAT002200&an=XNEWS00020141031eaav007bx&cat=a&ep=ASI, Media Report, including Wikileaks",NA,no,https://gist.github.com/abgaddi/b6ad566917035d7b033b8c2d3eed0aea,"https://www.google.com/maps/place/Central+Base+and+Special+Force+HQ+(Ministry+of+Interior+Affairs))/@34.5784406,69.1818215,14.97z/data=!4m5!3m4!1s0x38d16e6dbc9407a7:0xdd139f0a32503352!8m2!3d34.5823822!4d69.1786803","Dih Sabz division is coded for this project since the HQ of the Ministry of Affairs, which received the equipment donation, is located in this division. The location can be found by searching google maps",good,https://gist.github.com/abgaddi/b6ad566917035d7b033b8c2d3eed0aea,district
53970,China Grants 8.5 million USD of Agricultural Equipment to Afghanistan's Ministry of Agriculture,"On August 25th, 2015, Chinese Ambassador Deng Xijun granted 300 tractors and agricultural equipment worth 8.5 million USD to Assadullah Zamir, Minister of Agriculture, Irrigation, and Livestock, in a handover ceremony. China additionally sent 10 experts to teach Afghani how to use the machinery with the goal of improving productivity, through the mechanization of agriculture, to reach self-sufficiency. On November 8th, 2016, Afghanistan's High Economic Council decided to distribute the machinery to private seed companies, agricultural cooperatives, and mechanized agricultural stations. Distribution depends on each company's debt status and accordance to legislative standards. As of Jan 4th, 2018, all machinery has been handed over to Afghanistan as of August 2015, but it is unclear whether the machinery has been distributed internally within Afghanistan. STAFF_NOTE: Initial article indicated that these tractors may be related to International NGO ChinaAid, but further research suggested that the agricultural equipment originated from the Chinese government.","Agriculture, Forestry and Fishing","https://global-factiva-com.proxy.wm.edu/redir/default.aspx?P=sa&an=PARALL0020150902eb91000ha&cat=a&ep=ASE, Media Report, including Wikileaks; https://www.youtube.com/watch?v=WOTMkyOapLI, Media Report, including Wikileaks; https://www.youtube.com/watch?v=sjofHAPB22I, Media Report, including Wikileaks; http://bakhtarnews.com.af/eng/business/item/18763-china-donates-300-tractors-to-afghanistan.html, Media Report, including Wikileaks; http://www.bakhtarnews.com.af/eng/politics/item/25894-hec-holds-session.html, Media Report, including Wikileaks; http://www.afghanistantimes.af/china-donates-300-tractors-to-mail/, Media Report, including Wikileaks; http://af.mofcom.gov.cn/article/zxhz/201501/20150100879514.shtml, Government Source (Donor/Recipient)","https://global-factiva-com.proxy.wm.edu/redir/default.aspx?P=sa&an=PARALL0020150902eb91000ha&cat=a&ep=ASE, Media Report, including Wikileaks",Kabul,country_level,,,This project is coded up to country level since the intended distribution was to several locations within the country but none were specified,good code up,,country
56578,China Grants 4.288268 million AFA to Afghan Ministry of Foreign Affairs (linked to #53879),"On October 1, 2016, China provided 4.288268 million AFA to the Afghan Ministry of Foreign Affairs. From November 20, 2008, to December 21, 2019, China provides 858,140,268 Afghanistan Afghani (approx. 16.4 million USD) aids to Afghan Ministry of Foreign Affairs. The contribution was delivered over multiple years. About 97 million AFA (1.5 million USD) was spent. The funds were given in a grant used for acquisition of assets and the use of goods and services (#53879). DAD Platform Refer Project Code: AFG/230069; Old Project Code: AFG/0866901",Other Multisector,"http://dadafghanistan.gov.af/de/frame.jsp?src=/de/deView.faces?sessionid=154258875818446093&MasterID=1&SubModuleID=1&Hierarchy=A1_RT_OP_PROJECT&UserID=13&iLanguageID=1&jsf_sequence=1&projectid=8825&beansKey=154258875818446093_1542588941379, Government Source (Donor/Recipient); https://www.dropbox.com/s/ttwe1lxhfyzo0c2/May%202018%20Flat%20Export%20of%20Afghanistan%20DAD%20China%20Project%20Data.xlsx?dl=0, Other Official Source (non-Donor, non-Recipient); https://www.dropbox.com/s/cu75mmi3ek8d6sc/Flat%20Export%20of%20Geocoded%20Afghanistan%20DAD%20from%202014.xlsx?dl=0, Government Source (Donor/Recipient); https://www.dropbox.com/s/kt1n2ehv3w48hi2/DAD%20Afghanistan%20Project%20230069.pdf?dl=0, Other Official Source (non-Donor, non-Recipient); http://af.mofcom.gov.cn/article/zxhz/201501/20150100879514.shtml, Government Source (Donor/Recipient)",NA,NA,,,"https://www.openstreetmap.org/node/4532116203#map=17/34.52629/69.17643, https://www.mfa.gov.af/contact-us.html","Kabul city division is coded for this project since the headquarters of the ministry that received the grant. The location can be found searching Ministry of Foreign affairs in Open Street Map, and the address matches the address on the official website",good,https://gist.github.com/abgaddi/243604d65adb878ff37d676a926c9659,district
34533,"China makes $500,000 contribution to Afghan presidential elections","In 2009, China donated $500,000 for presidential elections in Afghanistan. This donation was the result of an agreement because China's and Afghanistan's foreign ministers.",Government and Civil Society,"https://global.factiva.com/redir/default.aspx?P=sa&an=NPRESE0020090720e57k000jh&cat=a&ep=ASE, Media Report, including Wikileaks","https://global.factiva.com/redir/default.aspx?P=sa&an=NPRESE0020090720e57k000jh&cat=a&ep=ASE, Media Report, including Wikileaks",NA,country_level,,,"This project is coded up to country level since there is no specific location that received assitance, but the whole country received aid for its elections",good code up,,country
34531,Donation of 30 million RMB of wheat to Afghanistan,"On 30 December 2008, China signed an agreement to donate 30m RMB worth of wheat to Afghanistan as part of rebuilding efforts. The agreements were signed by Chinese Ambassador to Afghanistan Yang Houlan and Afghan Foreign Minister Rangin Dafar Spanta. According to online information provided by China's ECCO in Afghanistan, over 8,000 tons (or tonnes) valued at 30 million CNY were delivered during 2009: STAFF_NOTE: #34531 should not be duplicate for #34528 as their delivery times, contract signing times are different. This transaction was listed under year 2009 by the Chinese Ministry of Commerce, updated commitment year accordingly.",Emergency Response,"https://global-factiva-com.proxy.wm.edu/redir/default.aspx?P=sa&an=BBCAPP0020081230e4cu000p1&cat=a&ep=ASE, Media Report, including Wikileaks; http://mercury.ethz.ch/serviceengine/Files/ISN/120233/ichaptersection_singledocument/7a7b6db6-6400-4793-b1ef-475da1579bd8/en/chapter+4.pdf., Media Report, including Wikileaks; http://af.mofcom.gov.cn/article/zxhz/201501/20150100879514.shtml, Government Source (Donor/Recipient); http://af.mofcom.gov.cn/article/zxhz/201501/20150100879514.shtml, Government Source (Donor/Recipient)","https://global-factiva-com.proxy.wm.edu/redir/default.aspx?P=sa&an=BBCAPP0020081230e4cu000p1&cat=a&ep=ASE, Media Report, including Wikileaks",Kabul,NO,https://gist.github.com/camilabaioni/7c905a6207066176a37147ba4a8a5578,https://global.factiva.com/ga/default.aspx,"Coded the Kabul City dsitrict. The global factive source states that ""China would provide Kabul with wheat worth 30 million Yuan"". the Location details also gave kabul as the location for wheat adn i found no other contradicting information",good,https://gist.github.com/camilabaioni/7c905a6207066176a37147ba4a8a5578,district
53888,China trains 20 doctors for Afghanistan Jamhoriat hospital,"In 2008, China trained 20 doctors for Afghanistan Jamhoriat hospital. The training worths 630,000 USD.

STAFF_NOTE: In 2014, China again committed to train medical personnels in Jamhoriat hospital (#37896). Jamhuriat hospital is located in Kabul at the following address: Chara-e-searar, Disttec 2, Kabul, Afghanistan Kabul, Afghanistan 0093. Its exact locational coordinates are available at https://www.google.com/maps/place/Jamhuriat+Hospital,+Kabol,+Afghanistan/@34.5254674,69.1689225,15z/data=!4m5!3m4!1s0x0:0xb2238c27edd9b0c2!8m2!3d34.5254674!4d69.1689225”.",Health,"http://dadafghanistan.gov.af/de/frame.jsp?src=/de/deView.faces?sessionid=154258875818446093&MasterID=12&SubModuleID=1&Hierarchy=A12_E_Projects&UserID=13&iLanguageID=1&jsf_sequence=1&projectid=2829&beansKey=154258875818446093_1542595297787, Government Source (Donor/Recipient)",NA,"Jamhuriat hospital is located in Kabul at the following address: Chara-e-searar, Disttec 2, Kabul, Afghanistan Kabul, Afghanistan 0093.", NO,https://gist.github.com/camilabaioni/7c905a6207066176a37147ba4a8a5578,"https://www.google.com/maps/place/Jamhuriat+Hospital/@34.5254674,69.1689225,15z/data=!4m2!3m1!1s0x0:0xb2238c27edd9b0c2?sa=X&ved=2ahUKEwj0yMD16cbvAhWQMVkFHVbZDKUQ_BIwCnoECBoQBQ",Coded the Kabul City dsitrict. Was able to find the hospital using google maps and then coded kabul using qgis. The ,good,https://gist.github.com/camilabaioni/7c905a6207066176a37147ba4a8a5578,district
53636,China donates desks and chairs to China-Afghan Friendship School,"On April 15, China Embassy in Afghanistan donated desks and chairs to China-Afghan Friendship School in Paghman District, Kabul, Afghanistan. The school is renamed as ""China-Afghan Friendship School"" （中阿友谊学校). This project is completed. 

In March 2018, China donated textbooks to China-Afghan Friendship School, which is recorded in project #54110.",Education,"http://af.china-embassy.org/chn/zagx/sbwl/t1454014.htm, Government Source (Donor/Recipient); https://www.mfa.gov.cn/chn//pds/gjhdq/gj/yz/1206/1206x2/t1454015.htm, Government Source (Donor/Recipient)",NA,NA,NO,https://gist.github.com/camilabaioni/44594a2bc4557b9511c25d11592c69b6,http://af.china-embassy.org/chn/zagx/sbwl/t1454014.htm,"Coded the Paghman District. The description and the article both gave Paghman as the location of the school, and no other information contradicted this.",good,https://gist.github.com/camilabaioni/44594a2bc4557b9511c25d11592c69b6,district
34515,Donation of US$1.4 million in equipment and vehicles (linked to #34500),"In June, 2004 China donated police communications equipment as well as off-road vehicles to Afghanistan's transitional government. This included an alarm system, computer LAN, wireless systems and a digital programmable dispatching system as well as 22 Cherokees made by Beijing Jeep Corporation. The value of this donation is US$1.4 million. This is the second donation of goods made by China to the Afghan government to promote bilateral ties. The first was in 2002 when China donated military uniforms, boots and coats to the Afghan police and army (See Project ID#34500)",Government and Civil Society,"https://global-factiva-com.proxy.wm.edu/redir/default.aspx?P=sa&an=XNEWS00020040630e06u004ed&cat=a&ep=ASE, Media Report, including Wikileaks; http://in.china-embassy.org/eng/zgbd/t163322.htm, Government Source (Donor/Recipient)","https://global-factiva-com.proxy.wm.edu/redir/default.aspx?P=sa&an=XNEWS00020040630e06u004ed&cat=a&ep=ASE, Media Report, including Wikileaks",NA,country_level,,https://global.factiva.com/ga/default.aspx,"Coded up to the country level since the donation of vehicles and equipment woudd be used throughout the country. Similarily, police equipment/uniforms were sent which would be sued throghout cities in Afghanistan.",good code up,,country
