project_id,title,description,crs_sector_name,sources,factiva_sources,location_details,GEO_codedUp,GEO_geojsonLink,GEO_sources,GEO_notes,Christian Notes,christian_geojson,level
37849,China disburses 500 Million RMB in grant assistance to Afghanistan (linked to #54451),"On October 28, 2014, Chinese President Xi Jinping and Afghanistan President Ashraf Ghani Ahmadzai signed the 'Agreement on Economic and Technical Cooperation between the Government of the People's Republic of China and the Government of Islamic Republic of Afghanistan' under which China would provide 500 million Chinese Yuan in grant assistance to the Afghan government in 2014 and another 1.5 billion Chinese Yuan in grant over three years from 2015 to 2017. The total amount of grant that was offered under the agreement was 2 billion Chinese Yuan. The grant is to be used to defend against Islamist militants along the border of Afghanistan and China. China will also train 3,000 Afghan professionals over the following 5 years. On 5 April 2015, Ambassador of Republic of China to Kabul, Mr. Deng Xijun, during his talks with Minister of Foreign Affairs, Mr. Salahuddin Rabbani, said that China would send a team to Afghanistan to draw up the framework for the disbursement of the 2 billion Chinese Yuan. Based on a 'Q&A' session with Professor and Director of Center for Russia and Central Asia Studies, Zhao Huasheng, China had provided the 500 million Chinese Yuan in 2014 and the 1.5 billion yuan is still in the pipeline. This project records the 500 million yuan disbursed in 2014.",Unallocated / Unspecified,"http://af2.mofcom.gov.cn/article/bilateralvisits/201503/20150300918885.shtml, Government Source (Donor/Recipient); http://af.mofcom.gov.cn/article/tbbd/201501/20150100856996.shtml, Government Source (Donor/Recipient); https://global-factiva-com.libproxy1.nus.edu.sg/redir/default.aspx?P=sa&NS=18&AID=9NAT002200&an=XNEWS00020141031eaav007bx&cat=a&ep=ASI, Media Report, including Wikileaks; http://mfa.gov.af/en/news/china-afghanistan-joint-statement-on-deepening-strategic-and-cooperative-partnership, Government Source (Donor/Recipient); http://mfa.gov.af/en/news/news-mfa-afg-fm-met-cn-amb-05-04-2015, Government Source (Donor/Recipient); http://carnegie-mec.org/2015/03/08/what-is-behind-china-s-growing-attention-to-afghanistan, NGO/Civil Society/Advocacy; https://global-factiva-com.libproxy1.nus.edu.sg/redir/default.aspx?P=sa&an=APAFGH0020141029eaas0000m&cat=a&ep=ASE, Media Report, including Wikileaks; http://news.xinhuanet.com/2014-10/28/c_1113016324.htm, Media Report, including Wikileaks; http://news.wenweipo.com/2014/10/29/IN1410290031.htm, Media Report, including Wikileaks; http://fec.mofcom.gov.cn/article/gbdqzn/upload/afuhan.pdf, Government Source (Donor/Recipient); https://www.reuters.com/article/us-china-afghanistan-idUSKBN0IH1D420141029, Media Report, including Wikileaks","https://global-factiva-com.libproxy1.nus.edu.sg/redir/default.aspx?P=sa&NS=18&AID=9NAT002200&an=XNEWS00020141031eaav007bx&cat=a&ep=ASI, Media Report, including Wikileaks; https://global-factiva-com.libproxy1.nus.edu.sg/redir/default.aspx?P=sa&an=APAFGH0020141029eaas0000m&cat=a&ep=ASE, Media Report, including Wikileaks",NA,country_level,,http://af2.mofcom.gov.cn/article/bilateralvisits/201503/20150300918885.shtml,This grant is designed to protect the Afghan-Chinese border by having China train soldiers and provide funding. It was coded up to country level because there was no specific details on where the training or activities took place.,good code up,,country
56575,China Grants 17.018 million AFA to Afghan Ministry of Foreign Affairs (linked to #53879),"On December 22, 2015, China provided 17.018 million AFA to the Afghan Ministry of Foreign Affairs. From November 20, 2008, to December 21, 2019, China provides 858,140,268 Afghanistan Afghani (approx. 16.4 million USD) aids to Afghan Ministry of Foreign Affairs. The contribution was delivered over multiple years. About 97 million AFA (1.5 million USD) was spent. The funds were given in a grant used for acquisition of assets and the use of goods and services (#53879). DAD Platform Refer Project Code: AFG/230069; Old Project Code: AFG/0866901",Other Multisector,"http://dadafghanistan.gov.af/de/frame.jsp?src=/de/deView.faces?sessionid=154258875818446093&MasterID=1&SubModuleID=1&Hierarchy=A1_RT_OP_PROJECT&UserID=13&iLanguageID=1&jsf_sequence=1&projectid=8825&beansKey=154258875818446093_1542588941379, Government Source (Donor/Recipient); https://www.dropbox.com/s/ttwe1lxhfyzo0c2/May%202018%20Flat%20Export%20of%20Afghanistan%20DAD%20China%20Project%20Data.xlsx?dl=0, Other Official Source (non-Donor, non-Recipient); https://www.dropbox.com/s/cu75mmi3ek8d6sc/Flat%20Export%20of%20Geocoded%20Afghanistan%20DAD%20from%202014.xlsx?dl=0, Government Source (Donor/Recipient); https://www.dropbox.com/s/kt1n2ehv3w48hi2/DAD%20Afghanistan%20Project%20230069.pdf?dl=0, Other Official Source (non-Donor, non-Recipient); http://af.mofcom.gov.cn/article/zxhz/201501/20150100879514.shtml, Government Source (Donor/Recipient)",NA,NA,No,https://gist.github.com/jmitchell01/ba6f6d2b079b37f1da57e215cc2b23f0,"http://af.mofcom.gov.cn/article/zxhz/201501/20150100879514.shtml,","The Ministry of Foreign Affairs received grants for equipment and for accomplishing goals. The Ministry is located in Kabul, the capital city, so I used QGIS to code the ADM2.",good,https://gist.github.com/jmitchell01/ba6f6d2b079b37f1da57e215cc2b23f0,district
37850,"China provides $1 million in cash assistance to Afghanistan government budget (Linked to Project ID#34498, #53537)","On 27 May 2003, Chinese Vice President Zeng Qinghong and Afghan Vice President Nimartullah Shaharani signed an agreement, under which China would provide $1 million in cash to Afghanistan. The report published by China Ministry of Foreign Affairs and Chinese media articles reported that the US$1 million was to support Afghanistan's national budget. The agreement was first signed together with #53537, in 2002 January, where 30 million Chinese Yuan aid package was delivered to Afghanistan. STAFF_NOTE: This project is part of umbrella project #34498. The transaction amount is accounted for here and is taken out of the umbrella project amount.",General Budget Support,"http://af2.mofcom.gov.cn/article/bilateralvisits/200411/20041100003858.shtml, Government Source (Donor/Recipient); https://global-factiva-com.libproxy1.nus.edu.sg/redir/default.aspx?P=sa&an=XNEWS00020030529dz5r000ld&cat=a&ep=ASE, Media Report, including Wikileaks; https://global-factiva-com.libproxy1.nus.edu.sg/redir/default.aspx?P=sa&an=aprs000020030527dz5r00p5v&cat=a&ep=ASE, Media Report, including Wikileaks; http://news.xinhuanet.com/newscenter/2003-05/27/content_889384.htm, Media Report, including Wikileaks; https://timesofindia.indiatimes.com/city/jaipur/finally-work-on-parwan-dam-project-to-begin-on-december-15/articleshow/62033210.cms, Media Report, including Wikileaks","https://global-factiva-com.libproxy1.nus.edu.sg/redir/default.aspx?P=sa&an=XNEWS00020030529dz5r000ld&cat=a&ep=ASE, Media Report, including Wikileaks; https://global-factiva-com.libproxy1.nus.edu.sg/redir/default.aspx?P=sa&an=aprs000020030527dz5r00p5v&cat=a&ep=ASE, Media Report, including Wikileaks",Kabul,country_level,,http://af2.mofcom.gov.cn/article/bilateralvisits/200411/20041100003858.shtml,"China provided $1 million to support Afghanistan's national budget. While the location_details states that it is Kabul, the project was only signed there, and it is supporting the national budget, which makes it country level.",good code up,,country
37898,Chinese government to assist Afghanistan's Ministry of Public Works with office supplies,"On 9 October 2011, China's Economic and Commercial Counselor and the Afghan Minister of Public Works Ahmed signed a contract for China to assist Afghanistan's Ministry of Public Works in the form of office equipment. Based on the agreement, the office equipment will be delivered by the end of December 2011. The equipment was financed by the Chinese government. On May 15, 2012, the handover ceremony of official equipment from China to Afghanistan was held on Afghanistan Ministry of Public Work. No sources indicate the content of the donation. According to Afghan Minister of Public Work Najibullah Aoudjan, the equipment will be used to improve the working conditions of Minister of Public Work.",Government and Civil Society,"http://af.mofcom.gov.cn/article/todayheader/201110/20111007773314.shtml, Government Source (Donor/Recipient); http://af.china-embassy.org/chn/zagx/sbwl/t932030.htm, Government Source (Donor/Recipient)",NA,NA,No,https://gist.github.com/jmitchell01/ba6f6d2b079b37f1da57e215cc2b23f0,"https://www.google.com/maps/place/Ministry+of+Public+Works/@34.5308634,69.2029767,15z/data=!4m2!3m1!1s0x0:0x36bdb2b1d63b552e?sa=X&ved=2ahUKEwiZs7jznc7vAhV6F1kFHYwqDuAQ_BIwEnoECB0QBQ",The Afghanistan Ministry of Public Works received office equipment from China. It is located in Kabul.,good,https://gist.github.com/jmitchell01/ba6f6d2b079b37f1da57e215cc2b23f0,district
53882,China provides Afghanistan 13 million Yuan for emergency assistance and uniforms,"In 2002, China provides 13 million Chinese Yuan (equivalent to 4 million USD) to Afghanistan for emergency assistance as well as other aids. The fund was delivered in March 2002. The fund was used deliver medical supplies, stationary (80,000 pieces) and uniforms for the army (50,000 pieces) and police (20,000 pieces), 30 computers to Ministry of Foreign Affairs. Part of the medicine was utilized in the north during the crises of Nahreen Earthquake. The fund is fully disbursed and used by 2006. DAD platform referral code: DAD/000357. STAFF_NOTE: This Project is not affiliated to #34498 because the transaction amounts and currency are separate.",Other Multisector,"http://dadafghanistan.gov.af/de/frame.jsp?src=/de/deView.faces?sessionid=154258875818446093&MasterID=12&SubModuleID=1&Hierarchy=A12_E_Projects&UserID=13&iLanguageID=1&jsf_sequence=1&projectid=357&beansKey=154258875818446093_1542592302998, Government Source (Donor/Recipient)",NA,NA,country_level,,Coded from project description,"In 2002, China provides 13 million Chinese Yuan (equivalent to 4 million USD) to Afghanistan for emergency assistance, which included military uniforms, police aid, medical aid, and other aid. Most of this aid did not have any information about where it was sent, so it was coded up to country level.",good code up,,country
53882,China provides Afghanistan 13 million Yuan for emergency assistance and uniforms,"In 2002, China provides 13 million Chinese Yuan (equivalent to 4 million USD) to Afghanistan for emergency assistance as well as other aids. The fund was delivered in March 2002. The fund was used deliver medical supplies, stationary (80,000 pieces) and uniforms for the army (50,000 pieces) and police (20,000 pieces), 30 computers to Ministry of Foreign Affairs. Part of the medicine was utilized in the north during the crises of Nahreen Earthquake. The fund is fully disbursed and used by 2006. DAD platform referral code: DAD/000357. STAFF_NOTE: This Project is not affiliated to #34498 because the transaction amounts and currency are separate.",Other Multisector,"http://dadafghanistan.gov.af/de/frame.jsp?src=/de/deView.faces?sessionid=154258875818446093&MasterID=12&SubModuleID=1&Hierarchy=A12_E_Projects&UserID=13&iLanguageID=1&jsf_sequence=1&projectid=357&beansKey=154258875818446093_1542592302998, Government Source (Donor/Recipient)",NA,NA,no,https://gist.github.com/jmitchell01/ba60f5683b0b52cceb98650439ca0a0f,https://reliefweb.int/report/afghanistan/afghanistan-earthquake-appeal-no1002,"Nahrin District is coded in this row. According to the project description, some of the medicine was sent to Nahrin District, which felt the worst of the Nahreen Earthquake. It was coded on QGIS.",good,https://gist.github.com/jmitchell01/ba60f5683b0b52cceb98650439ca0a0f,district
53882,China provides Afghanistan 13 million Yuan for emergency assistance and uniforms,"In 2002, China provides 13 million Chinese Yuan (equivalent to 4 million USD) to Afghanistan for emergency assistance as well as other aids. The fund was delivered in March 2002. The fund was used deliver medical supplies, stationary (80,000 pieces) and uniforms for the army (50,000 pieces) and police (20,000 pieces), 30 computers to Ministry of Foreign Affairs. Part of the medicine was utilized in the north during the crises of Nahreen Earthquake. The fund is fully disbursed and used by 2006. DAD platform referral code: DAD/000357. STAFF_NOTE: This Project is not affiliated to #34498 because the transaction amounts and currency are separate.",Other Multisector,"http://dadafghanistan.gov.af/de/frame.jsp?src=/de/deView.faces?sessionid=154258875818446093&MasterID=12&SubModuleID=1&Hierarchy=A12_E_Projects&UserID=13&iLanguageID=1&jsf_sequence=1&projectid=357&beansKey=154258875818446093_1542592302998, Government Source (Donor/Recipient)",NA,NA,No,https://gist.github.com/jmitchell01/ba6f6d2b079b37f1da57e215cc2b23f0,Coded from project description,"The Ministry of Foreign Affairs received 30 computers as part of this aid. The Ministry is located in Kabul, the capital city, so I used QGIS to code the ADM2.",good,https://gist.github.com/jmitchell01/ba6f6d2b079b37f1da57e215cc2b23f0,district
34629,Chinese Government provides $4 million grant for 100 ambulances,"In 2011, two agreements were signed for the donation of 100 ambulances by the Chinese government to Afghanistan's Ministry of Public Health. The first agreement, which was for the first 50 batch of ambulance, was signed on 17 October 2011 by Dr. Soraya Dalil, Acting Minister of Public Health and Hogen Chen, Trade and Economic Counselor of Chinese Embassy in Kabul. The second agreement for the second batch of ambulance was signed on 14 December 2011 by Wu Gangchen, the Commercial counselor of China embassy in Afghan and Abdul Baser Sarwar, Deputy Minister of Public Health of Afghanistan. The ambulances are worth 4 million USD and were delivered to Afghanistan by China Tianjin Universal Machinery Import and Export Corporation(UMAC). Delivery of the ambulance began in 2011. Afghan Public Health Ministry released a statement regarding the donation on 20 September 2012, suggesting that the 100 ambulance had been delivered. These ambulances were to be distributed to health facilities in various provinces throughout Afghanistan.",Health,"https://global.factiva.com/redir/default.aspx?P=sa&an=CHNDHK0020121007e8a800074&cat=a&ep=ASE, Media Report, including Wikileaks; https://global-factiva-com.libproxy1.nus.edu.sg/redir/default.aspx?P=sa&an=BAKHNA0020111020e7ai00001&cat=a&ep=ASE, Media Report, including Wikileaks; http://moph.gov.af/en/news/4126, Government Source (Donor/Recipient); http://english.mofcom.gov.cn/aarticle/counselorsreport/asiareport/201112/20111207879361.html, Government Source (Donor/Recipient); http://news.xinhuanet.com/english/world/2012-09/20/c_131863211.htm, Media Report, including Wikileaks; http://en.tmg.cn/comcontent_detail5/&FrontComContent_list01-1337568580834CurrentIds=2a3e7569-ff8f-46f5-92d8-1e42a1437513__3ce7b048-cc75-4907-9fbb-f3e2f59de58d&comContentId=3ce7b048-cc75-4907-9fbb-f3e2f59de58d.html, Implementing/Intermediary Agency Source; http://af.china-embassy.org/chn/zagx/sbwl/t972618.htm, Government Source (Donor/Recipient); http://af.mofcom.gov.cn/article/zxhz/201501/20150100879514.shtml, Government Source (Donor/Recipient); http://old.moph.gov.af/en/news/4126, Government Source (Donor/Recipient)","https://global.factiva.com/redir/default.aspx?P=sa&an=CHNDHK0020121007e8a800074&cat=a&ep=ASE, Media Report, including Wikileaks; https://global-factiva-com.libproxy1.nus.edu.sg/redir/default.aspx?P=sa&an=BAKHNA0020111020e7ai00001&cat=a&ep=ASE, Media Report, including Wikileaks",NA,country_level,,http://af.china-embassy.org/chn/zagx/sbwl/t972618.htm,China donated 100 ambulances to Afghanistan. The project description notes that these ambulances were to a variety of provinces but there was no information on which provinces so it was coded up to country level.,good code up,,country
53721,"China agrees to provide 30 annual national scholarships to Afghans (Linked to #37861, #53703, #53641)","In 2006, China stated in the Joint Statement with Afghanistan that it will provide 30 annual scholarships for year-long training in China to Afghans. The details of the implementation of the scholarships are unclear. In 2014, China agreed on providing 500 national scholarships to Afghanistan (See project #37861 for details), an additional 50 annually in 2011 (#53703) and an additional 50 in 2016 (#53641).",Education,"http://af.china-embassy.org/chn/zagx/wxzl/t852277.htm, Government Source (Donor/Recipient); http://www.gov.cn/gongbao/content/2006/content_352476.htm, Government Source (Donor/Recipient)",NA,NA,country_level,,http://af.china-embassy.org/chn/zagx/wxzl/t852277.htm,China provided 30 year-long scholarships for Afghani people to go to China for training. It was coded up to country level because the training took place outside of Afghanistan.,good code up,,country
53743,Chinese Government RMB 6 million grant for provision of police equipment to Afghanistan’s Ministry of Interior,"On November 8, 2014, China delivered police equipment worths 6 million Chinese Yuan to Afghanistan. The equipment was handed to Minister of Interior. The materials handed over by the Chinese side include communication equipment, forensic cameras, police helmets and shields, and rapid detection equipment for drugs (drugs). The Chinese side also provided assistance to the Afghan in equipment operation training. In addition to these, there are some computer equipment, which is Lenovo's E49 model. The network shows that the price of such computers does not exceed RMB 4,000. There is no offensive weapon in this batch of public police materials, indicating that China has taken into consideration its stance and position when choosing assistance, and avoided transmitting information that is deeply involved in the armed conflict in Afghanistan.",Government and Civil Society,"http://af.china-embassy.org/chn/zagx/sbwl/t1209609.htm, Government Source (Donor/Recipient); http://news.sina.com.cn/c/2014-11-09/234731118901.shtml, Media Report, including Wikileaks; http://hlj.ifeng.com/china/detail_2014_11/10/3128967_0.shtml, Media Report, including Wikileaks",NA,NA,No,https://gist.github.com/jmitchell01/ba6f6d2b079b37f1da57e215cc2b23f0,https://en.wikipedia.org/wiki/Ministry_of_Interior_Affairs_(Afghanistan),China delivered police equipment worths 6 million Chinese Yuan to the Ministry of the Interior. All the equipment was defensive equipment or for detection in order to curb corruption. The Ministry is located in Kabul.,good,https://gist.github.com/jmitchell01/ba6f6d2b079b37f1da57e215cc2b23f0,district
53812,China provides 1 million USD material aid to Afghanistan,"On October 5, 2004, Economic and Commercial Office of the Embassy of People’s Republic of China in the Islamic Republic of Afghanistan granted office equipment, cultural and athletic equipment (around USD 1 million) to Afghanistan. The grant includes 400 computers, 300 printers, 70 copiers, televisions, bicycles, footballs, basketballs, and some Sports apparels, etc. The delivery ceremony is held in Afghanistan Ministry of Foreign Affairs.

Chinese government provided the above-mentioned suppliers to departments of Afghanistan under with the provisions signed by China and Afghanistan in October and November last year. All goods have been transported to the capital of Afghanistan, Kabul. 

This project is different from project #34514 since the delivery date and grant contents is different.",Other Social infrastructure and services,"http://af.mofcom.gov.cn/article/jmxw/200411/20041100303076.shtml, Government Source (Donor/Recipient); http://news.sina.com.cn/w/2004-10-05/18343838808s.shtml, Media Report, including Wikileaks",NA,NA,country_level,,http://af.mofcom.gov.cn/article/jmxw/200411/20041100303076.shtml,"China gave 400 computers, 300 printers, 70 copiers, televisions, bicycles, footballs, basketballs, and some sports apparels, etc to Afghanistan. It was delivered to the Ministry of the Interior, which is located in Kabul. However, the aid did not stay there, but it was not detailed where, so it was coded up to country level.",good code up,,country
53818,"China provides 35,000 blankets and 5,000 tents worth 30 million yuan to Pakistan refugees in Afghanistan","On December 12, 2015, Mr. Yao Jing, Ambassador of the People's Republic of China to the Islamic Republic of Afghanistan and H.E. Eng. Nasir Ahmad Durrani, the Minister of Rural Rehabilitation and Development of the Islamic Republic of Afghanistan signed taking-over certificate of China’s humanitarian relief materials. The humanitarian relief materials include: 5000 tents and 35000 blankets worth 30 million Chinese yuan. 

The materials will be distributed by the MRRD on vulnerable families. The aid is to help resettle Pakistan refugees in Afghanistan.",Emergency Response,"http://af.mofcom.gov.cn/article/jmxw/201512/20151201209104.shtml, Government Source (Donor/Recipient); http://af.china-embassy.org/chn/sgxw/t1323936.htm, Government Source (Donor/Recipient); http://old.mrrd.gov.af/en/news/mrrd-minister-and-ambassador-of-china-signed-taking-over-certificate, Government Source (Donor/Recipient)",NA,NA,country_level,,http://af.mofcom.gov.cn/article/jmxw/201512/20151201209104.shtml,There was no information on where the tents and medical supplies for the refugee were sent. It was coded up to country level.,good code up,,country
34625,Chinese Government provides RMB 32.7 million grant for Afghan Presidential Office Multifunctional Center Construction Project (Linked to Project ID#69984),"In 2008, the Chinese Government provided an RMB 32.7 million grant for the Afghan Presidential Office Multifunctional Center Construction Project. The purpose of the Multifunctional Center (or Multifunction Center) was to host state dinners and press conferences and facilitate diplomatic negotiations. The project covered an area of 1150 square meters. This construction area was 2979 square meters. China Friendship Development International Engineering Design & Consultation Corporation (FDDC) and China Railway Shisiju Group Corporation — also known as China Railway 14th Bureau Group Co., Ltd. — were the contractors responsible for project implementation. 

Construction began on June 2, 2008. Then, on December 22, 2009, China’s Ambassador to Afghanistan Zheng Qingdian, was invited for a presidential visit to inspect the progress of project; high standards and strict requirements were expected in ensuring project quality especially for the 55th anniversary of the establishment of diplomatic ties. Construction of the Multifunctional Center was completed at the end of December 2009. 

The project is linked to Project ID#69984, which captured the Technical Cooperation Project for Phase I of the Afghan Presidential Office Multifunctional Center. 

STAFF_NOTE: The Chinese project title is 阿富汗总统府多功能中心. This project was located at the Afghan Presidential Palace. Its locational coordinates are available at https://www.google.com/maps/place/ARG+Presidential+Office/@34.525212,69.174551,17z/data=!3m1!4b1!4m5!3m4!1s0x38d16eb2956e5717:0x9680ffc5f17f6a22!8m2!3d34.525212!4d69.1767397.",Government and Civil Society,"http://www.zt14hw.com/EN/project.asp?id=15, Implementing/Intermediary Agency Source; http://www.fddc.com.cn/en/Business_Mes.aspx?id=146&type=64&f=1, Implementing/Intermediary Agency Source; http://af.china-embassy.org/eng/dsxx/remarks/t852489.htm, Government Source (Donor/Recipient); http://af.china-embassy.org/chn/zagx/sbwl/t647438.htm, Government Source (Donor/Recipient); http://www.xinhuanet.com//english/2017-01/16/c_135987144.htm, Media Report, including Wikileaks; http://af.china-embassy.org/eng/sgxw/t1263718.htm, Government Source (Donor/Recipient); http://www.crssg.com/art/2017/1/25/art_1866_509080.html, Implementing/Intermediary Agency Source; https://www.fmprc.gov.cn/mfa_eng/wjb_663304/zwjg_665342/zwbd_665378/t1719914.shtml , Government Source (Donor/Recipient); http://af2.mofcom.gov.cn/article/headnews/201112/20111207887102.shtml, Government Source (Donor/Recipient); http://af2.mofcom.gov.cn/article/headnews/201112/20111207887318.shtml, Government Source (Donor/Recipient); https://www.deseret.com/2010/7/3/20125650/as-u-s-fights-china-spends-in-afghanistan , Media Report, including Wikileaks; http://www.crssg.com/art/2019/12/27/art_2619_3041104.html , Implementing/Intermediary Agency Source; http://www.fdi.gov.cn/1800000121_23_59291_0_7.html , Government Source (Donor/Recipient); http://www.cr14gi.com/art/2018/9/25/art_14839_2698320.html , Implementing/Intermediary Agency Source; http://jjhzj.mofcom.gov.cn/article/y/201001/20100106747790.shtml, Government Source (Donor/Recipient)",NA,This project was located at the Afghan Presidential Palace.,No,https://gist.github.com/jmitchell01/ba6f6d2b079b37f1da57e215cc2b23f0,"https://www.google.com/maps/place/ARG+Presidential+Office/@34.525212,69.1767397,15z/data=!4m2!3m1!1s0x0:0x9680ffc5f17f6a22?sa=X&ved=2ahUKEwi4zMzW08zvAhVNGVkFHVRFA1gQ_BIwGHoECDMQBQ","China provided a grant for the Afghan Presidential Office Multifunctional Center Construction Project, which is located at Afghanistan Presidential Palace. The Palace is located in Kabul.",good,https://gist.github.com/jmitchell01/ba6f6d2b079b37f1da57e215cc2b23f0,district
